name,subtitle,backers,goal,pledged,usd_pledged,created_at,launched_at,deadline,state_changed_at,category,location,staff_pick,is_in_post_campaign_pledging_phase,state,campaign_id,scrape_date,days_left,description
"Trebuchette - the snap-together, desktop trebuchet",We're building snap-together model trebuchets that are perfect for office warfare or annoying your roommate!,1876,48000.0,96248.96,96248.96,3/19/2011 2:20,3/22/2011 12:21,4/22/2011 12:21,1303449134,Hardware,Mountain View,True,,successful,428c9c3927,2/27/2025,,Description could not be generated
Z-Unlimited add-on for Ultimaker,The Z-Unlimited is an Ultimaker 3D printer add-on which convert your own trusty 3D printer into a printer with unlimited heights.,81,15000.0,27074.0,30257.548,12/1/2014 17:57,3/3/2015 15:10,4/12/2015 14:10,1428819002,3D Printing,Amsterdam,True,,successful,413da81203,2/27/2025,,Description could not be generated
Robot Army Starter Kit,"A do-it-yourself Delta Robot kit that's fun to build, sharp to look at, and a great point of departure for your own project!",289,10000.0,25031.55,25031.55,6/6/2013 14:22,2/1/2014 16:03,3/3/2014 16:03,1393833794,Hardware,Las Vegas,True,,successful,40407ee546,2/27/2025,,Description could not be generated
DigiPixel. An LED Game Shield For Your Arduino or Digispark.,"Make programming fun by creating your own games, animations and more with the DigiPixel shield. With free worldwide shipping!",557,10000.0,14946.0,13620.61846,11/11/2013 18:57,12/10/2013 19:11,1/10/2014 18:00,1389348017,DIY Electronics,Tolland,True,,successful,3fdfe85da9,2/27/2025,,Description could not be generated
"blink(1) mk2, the USB RGB LED, improved",blink(1) mk2 is a small USB light to give you glanceable notice of anything on your computer or the internet.,2207,28000.0,108785.55,108785.55,6/21/2013 0:38,7/19/2013 15:44,8/24/2013 15:44,1377330266,Hardware,Los Angeles,True,,successful,3fa65e1def,2/27/2025,,Description could not be generated
Light Pong: the 1-dimensional game console,"Where the past meets the future. 
Dazzling LED Light | Plays Multiple Games | Portable",1472,50000.0,147469.0,147469.0,3/16/2021 9:00,9/28/2021 21:34,10/28/2021 21:34,1635428091,Hardware,Chicago,True,,successful,3fa334c040,2/27/2025,,Description could not be generated
Mapping with Drones,"We are bringing mapping to the masses. Our site will provide users with the capability to easily create current, high-resolution maps.",243,30000.0,33272.0,33272.0,6/26/2014 1:20,7/9/2014 23:35,8/9/2014 8:00,1407542412,Web,San Diego,True,,successful,3f51f84ab6,2/27/2025,,Description could not be generated
The Bright Eyes Kit - DIY LED glasses to inspire programming,"Bright Eyes is a DIY kit that inspires people to learn programming and look cool while doing it! Glasses with 174 LEDs, enough said!",145,17500.0,17696.1,28542.64914,10/18/2012 17:44,11/2/2012 17:54,11/23/2012 18:54,1353668053,Technology,Hackney,True,False,successful,3edfc30cbd,2/27/2025,,Description could not be generated
Mycroft Mark II: The Open Voice Assistant,The open answer to Amazon Echo and Google Home.  Mycroft brings you the power of voice while maintaining privacy and data independence.,2245,50000.0,394572.0,394572.0,10/26/2017 4:06,1/25/2018 23:52,2/24/2018 23:52,1519487579,Hardware,Kansas City,True,,successful,3e8b21213d,2/27/2025,,Description could not be generated
YesWelder Firstess CT2050: Powerful 7-in-1 Welder & Cutter,"Break Your Welding Limits: AC/DC TIG, Pulse, Plasma Cutting, Stick, Aluminum Welding, Built-in Air Compressor — All In One Machine.",2645,50000.0,3241337.3,3241337.3,5/7/2022 14:07,5/19/2022 23:40,7/18/2022 23:40,1658158835,Hardware,Charleston,True,False,successful,3e309127d1,2/27/2025,,Description could not be generated
Big Ocean Bottle - The Smart Bottle That Cleans Our Oceans,The water bottle that directly funds ocean plastic collection. NFC-enabled with companion app | Dual opening | Vacuum  insulation,2903,10000.0,212611.0,294262.3198,7/20/2021 21:35,9/14/2021 14:27,10/29/2021 14:27,1635488843,Technology,London,True,False,successful,3deb5bbc79,2/27/2025,,Description could not be generated
SHARGE Disk 丨The ultimate storage solution for EDC device,Two-bottle-cap size丨Cool down your SSD by 20°C丨Cable-free丨Tool-free assembly丨Sending a 4K movie in <2min,4704,40000.0,4228232.0,539275.6013,5/19/2023 10:55,6/7/2023 21:00,7/27/2023 21:00,1690462813,Gadgets,New York,True,False,successful,3d5cce8fdb,2/27/2025,,Description could not be generated
"HeavyM, bring projection to another level !",Let's imagine projection mapping into the hand of all the creative people.,1176,20000.0,81089.72,88794.89682,5/11/2015 23:44,5/27/2015 12:11,7/1/2015 5:50,1435701003,Software,Paris,True,,successful,3d1c67a553,2/27/2025,,Description could not be generated
Brewbot: The Smart Brewing Appliance,Smart technology meets brewing. Now anyone can brew high quality craft beers using their smartphone.,381,100000.0,114368.2,183446.7095,7/9/2013 20:07,9/22/2013 1:16,10/23/2013 1:16,1382462185,Hardware,Belfast,True,,successful,3cf75467a0,2/27/2025,,Description could not be generated
"Control VR- The Future of Virtual Reality, Animation & more","Control VR is a next-generation wearable technology that turns your hands into the ultimate intuitive controller for PCs, VR and beyond",1161,250000.0,442227.84,442227.84,5/13/2014 10:25,6/6/2014 2:57,7/6/2014 2:57,1404586646,Technology,Los Angeles,True,,successful,3ce9bbe6f4,2/27/2025,,Description could not be generated
"Reactor Core - Arduino/AVR Programmer, DIY Soldering Kit","Reactor Core: This is a 3-in1 programmer for Arduino & AVR based microcontrollers. Optional DIY soldering kit, solder stencil, & paste.",111,1500.0,5214.78,5214.78,1/19/2014 6:49,2/15/2014 11:23,3/24/2014 10:23,1395627806,DIY Electronics,High Point,True,,successful,3ca54448b3,2/27/2025,,Description could not be generated
Lumos Nyxel | The Safest & Smartest Urban (E)-Bike Helmet,"Ride smarter with 360° visibility, Quin-powered crash detection, and exclusive designs—Only backers decide what hits the streets!",904,20000.0,165033.0,165033.0,8/21/2024 16:52,10/29/2024 22:59,12/1/2024 13:00,1733029201,Hardware,Boston,True,True,successful,3c72fd6543,2/27/2025,,Description could not be generated
Snoppa Rover Electric Stabilization Cinema Dolly,Electric Stabilization | Preprogrammed Movement | Precise Speed Control | Smart Object Tracking | Camera Control,204,500001.0,3432122.0,440683.7441,1/23/2022 23:33,2/7/2022 22:01,3/24/2022 21:01,1648126869,Camera Equipment,Shenzhen,True,,successful,3c57e9505c,2/27/2025,,Description could not be generated
"PLEN2, the world’s first printable open-source humanoid.",PLEN2 guides you to the advanced technology world and help you grow. Anyone can easily build and personalize it.,187,40000.0,66420.0,66420.0,3/5/2015 18:36,3/7/2015 1:06,5/6/2015 0:06,1430842000,Robots,Osaka-shi,True,,successful,3c5443c2fb,2/27/2025,,Description could not be generated
AV Panel: Acoustic Foam LED Panels,"Illuminate sound, eliminate echos. Wi-Fi controlled lights that seamlessly merge sound and visuals.",35,15000.0,15422.0,15422.0,5/4/2023 6:42,6/15/2024 9:04,7/15/2024 9:04,1721005449,Gadgets,Des Moines,True,False,successful,3c3108d34e,2/27/2025,,Description could not be generated
The Imaginary Marching Band,Open-source wearable instruments that allow people to create real music through pantomime.,121,10000.0,10665.56,10665.56,4/29/2011 6:00,5/10/2011 11:18,6/9/2011 11:18,1307589516,Sound,New York,True,,successful,3b62aad128,2/27/2025,,Description could not be generated
Rotolight Anova PRO 3 - Professional LED Lighting,"IP65 All-weather Rating | Powerful 22,000 LUX Output | Magic Eye Ambient Light Temp Matching | RGBWW Colour LED",50,15000.0,95506.0,117402.6511,7/19/2023 6:22,10/12/2023 23:57,11/18/2023 0:57,1700240249,Camera Equipment,London,True,False,successful,3b5df1f589,2/27/2025,,Description could not be generated
Soundlazer VR - Surround yourself in a virtual sound cloud,This new directional speaker will change how you listen to music. Immerse yourself in a private sound cloud without disturbing others.,246,24750.0,68734.0,68734.0,2/2/2016 2:11,6/1/2016 21:06,7/31/2016 21:06,1469970416,Technology,Los Angeles,True,,successful,3b5c2100e2,2/27/2025,,Description could not be generated
MIYO: The most amazing audio experience outside the studio.,MIYO is a world-class digital-to-analog converter—your music’s new best friend. It makes all of your audio better—at home or on the go.,223,20000.0,45931.0,45931.0,10/14/2014 11:09,12/9/2014 8:06,1/8/2015 8:06,1420675575,Sound,Loveland,True,,successful,3b29b99580,2/27/2025,,Description could not be generated
PLAY FOR DREAM MR: World's 1st AndroidBased Spatial Computer,"True 8K Micro-OLED Screen | 1,000-inch Cinema-Level Display | Snapdragon XR2+ Gen 2 Powerful Gaming Performance | 6000+ Steam AAA Games",215,38972.0,2271650.0,291377.458,7/4/2024 12:31,9/5/2024 21:00,10/20/2024 21:00,1729429256,Hardware,Singapore,True,False,successful,3b1ac6609e,2/27/2025,,Description could not be generated
Waylens - A Data Driven Automotive Camera System,"A beautifully crafted camera system that empowers drivers to easily capture, edit, and share interesting moments right from the road.",1674,55000.0,606622.5,606622.5,7/28/2015 23:55,10/13/2015 13:15,11/12/2015 14:15,1447308952,Camera Equipment,Boston,True,,successful,3aeb6ff711,2/27/2025,,Description could not be generated
HUDWAY Glass: keeps your eyes on the road while driving,A universal vehicle accessory turning your smartphone into a head-up display (HUD) for any car,9095,100000.0,622785.0,622785.0,4/1/2015 13:58,10/8/2015 3:30,11/8/2015 4:30,1446928235,Gadgets,Marina del Rey,True,,successful,3ac667fdfd,2/27/2025,,Description could not be generated
CodeScty - Like Schoolhouse Rock for Computer Science,CodeScty uses original hip hop music & videos to teach foundational computer science concepts to more diverse communities.,524,40000.0,51600.0,51600.0,1/24/2019 3:57,3/22/2019 6:32,4/21/2019 6:32,1555799547,Software,New York,True,,successful,3a7c6a36db,2/27/2025,,Description could not be generated
eora 3D | High-Precision 3D Scanning on Your Smartphone,"Green lasers are cool, especially when they turn your smartphone into a highly accurate and affordable 3D scanner.",2139,80000.0,599925.0,599925.0,8/10/2015 19:11,10/20/2015 4:39,11/19/2015 5:39,1447882764,3D Printing,Sydney,True,,successful,3a29e0b065,2/27/2025,,Description could not be generated
RGKit Play: Play with movement like a pro.,"A motion control kit that lets you add tons of movements to your design, camera and light, instantly.",456,50000.0,206835.08,206835.08,7/30/2020 19:01,9/22/2020 20:55,10/31/2020 15:30,1604129400,Camera Equipment,Newark,True,False,successful,3a00710b0a,2/27/2025,,Description could not be generated
Icons for your iPhone apps,"I make cool icons for iPhone developers at http://glyphish.com and if I can collect $500 in donations, I'll release the whole set...",98,500.0,1820.0,1820.0,4/30/2009 3:52,4/30/2009 5:11,6/16/2009 3:00,1245092431,Software,New York,True,,successful,39d95156db,2/27/2025,,Description could not be generated
dadamachines: music machines for everyone!,"The dadamachines automat toolkit enables you to tap, move and bang to make sound with the world around you. Hackable & open-source!",488,20000.0,150548.0,163533.5448,10/14/2016 21:32,3/29/2017 14:45,4/29/2017 5:59,1493416740,Sound,Berlin,True,,successful,39cd773e19,2/27/2025,,Description could not be generated
Revopoint INSPIRE 3D Scanner - For All Creators,A compact yet powerful user-friendly 3D scanner that's surprisingly affordable.,3801,20000.0,1279281.0,1279281.0,7/13/2023 17:45,8/16/2023 21:00,9/15/2023 21:00,1694782830,3D Printing,Los Angeles,True,False,successful,399cacb491,2/27/2025,,Description could not be generated
Podo - The First Stick and Shoot Camera,"Forget the selfie stick. Podo is a wireless, re-stickable camera that turns any surface into a photo booth. Just stick, shoot, & share.",3609,50000.0,427565.0,427565.0,7/19/2013 7:48,3/3/2015 3:00,4/21/2015 12:00,1429588811,Hardware,San Francisco,True,,successful,3901e92b09,2/27/2025,,Description could not be generated
SYNEK - Any beer tapped fresh on your counter,"SYNEK is a draft system that serves any beer, fresh from the tap, anywhere you want it.",2191,250000.0,648535.69,648535.69,5/7/2014 22:59,6/24/2014 23:00,7/24/2014 23:00,1406214040,Hardware,St. Louis,True,,successful,38aa05ecdc,2/27/2025,,Description could not be generated
LightUp: Learn by Making,Kids learn electronics by building projects: combines electronic building blocks with the first-ever augmented reality tutor app.,1034,50000.0,120469.0,120469.0,4/19/2013 0:53,5/17/2013 12:00,7/1/2013 9:00,1372640433,Hardware,Stanford,True,,successful,38a65f3df4,2/27/2025,,Description could not be generated
1 Second Everyday App,Imagine a movie that includes every day of the rest of your life…,11281,20000.0,56959.4,56959.4,10/11/2012 12:22,11/27/2012 23:03,12/27/2012 23:03,1356620618,Apps,Brooklyn,True,,successful,38a223576d,2/27/2025,,Description could not be generated
Hestia: Turn Your Smartphone Into A Smart Telescope,"Unlock the Universe with Hestia: capture the Sun, the awe of the upcoming 2024 solar eclipse, the Moon and beyond.",13983,10000.0,4129095.0,4129095.0,6/8/2023 16:16,7/18/2023 22:01,8/17/2023 22:01,1692280905,Space Exploration,New York,True,False,successful,3858004fb7,2/27/2025,,Description could not be generated
B-Squares:  Modular Solar Powered Electrics.,B-Squares is a 3D modular electronics system with an emphasis on (but not limited to) solar power and expandable energy storage.,1110,25000.0,145034.61,145034.61,4/26/2011 19:23,5/1/2011 23:35,6/6/2011 12:01,1307332862,Hardware,Seattle,True,,successful,37c43ec255,2/27/2025,,Description could not be generated
Pozyx: accurate indoor positioning for Arduino,Pozyx is an Arduino-compatible platform that provides centimeter accurate positioning and motion information both indoor and outdoor.,164,27000.0,56136.0,61569.98164,5/28/2015 5:31,6/1/2015 15:32,7/1/2015 15:32,1435735973,DIY Electronics,Brussels,True,,successful,37b98a38fb,2/27/2025,,Description could not be generated
London Layout: Pocket Sized,Creating an app and leaflet to build a complete user experience for an alternative London underground map,110,1100.0,1466.0,2346.827863,6/17/2013 20:14,9/23/2013 20:10,11/4/2013 7:59,1383523141,Technology,London,True,,successful,37b354726c,2/27/2025,,Description could not be generated
OURA ring. Improve sleep. Perform better.,OURA is a revolutionary ring-sized wellness computer that helps you sleep and perform better.,2383,100000.0,651803.0,651803.0,7/1/2015 23:27,8/18/2015 21:22,9/24/2015 21:22,1443100948,Wearables,San Francisco,True,,successful,372a2c0b39,2/27/2025,,Description could not be generated
Toaster - Dual Output USB Step Up Breadboard Power Supply.,Power your breadboard projects with a single 5V USB port. Toaster contains dual power rails to give voltages from 3.3V upto 16V.,1058,5000.0,27517.0,20398.01227,10/20/2013 9:18,3/9/2016 9:10,3/30/2016 8:10,1459296621,Hardware,Wagga Wagga,True,,successful,36d1d1ef89,2/27/2025,,Description could not be generated
Jartoo: World's First Carbon Nanotube Heated Blanket,Far-Infrared | Carbon Nanotube | Apalos FlexHT | 1-Minute Rapid Heating | Low & Safe Voltage | 60% Energy Savings | Repeated Washable,2291,10000.0,491036.0,491036.0,10/15/2024 15:14,11/7/2024 21:01,12/22/2024 11:59,1734839941,Hardware,Irvine,True,True,successful,36c89d1dc2,2/27/2025,,Description could not be generated
Printrbot: Your First 3D Printer,A desktop 3D printer you can build in a couple hours.  Print plastic parts you design or download - even parts for another printer.,1808,25000.0,830827.51,830827.51,11/13/2011 13:36,11/18/2011 7:18,12/18/2011 7:18,1324163933,Hardware,Lincoln,True,,successful,3688b12965,2/27/2025,,Description could not be generated
Espruino: JavaScript for Things,"The world's first JavaScript microcontroller for beginners or experts, now Open Source. Be creative with intelligent control!",1692,20000.0,100710.0,156783.9291,3/12/2013 23:20,8/27/2013 18:12,9/26/2013 18:12,1380190356,Hardware,Cambridge,True,,successful,36769e58ff,2/27/2025,,Description could not be generated
miniPCR: A DNA Discovery System for Everyone,"DNA curious? Open up the world of DNA science and exploration with a portable, powerful, and affordable PCR-based DNA Discovery System",245,20000.0,66701.0,66701.0,9/5/2014 3:45,10/30/2014 22:12,12/13/2014 11:00,1418439611,Hardware,Cambridge,True,,successful,36001eed73,2/27/2025,,Description could not be generated
Ghost Pacer: Your Personal Holographic Workout Partner,Maximize Every Workout with an On-Demand Holographic Running Partner,802,25000.0,151193.1,151193.1,5/12/2020 5:10,8/5/2020 21:56,9/11/2020 21:56,1599832603,Wearables,Seattle,True,False,successful,35a03caad6,2/27/2025,,Description could not be generated
Next-Gen Smart Archery & Shooting,Precision Tracking | Realistic Feedback | VR & Big Screen Modes | Fitness & Fun | Dynamic Gameplay | Built to Last | For All Levels,496,39000.0,1418492.0,182539.2672,7/3/2024 18:20,10/22/2024 21:50,11/12/2024 22:50,1731423009,Hardware,Hong Kong,True,True,successful,3592c2c497,2/27/2025,,Description could not be generated
KOMBU | The modern kombucha brewer.,Purpose-built to craft real kombucha - at a fraction of the cost of store-bought kombucha.,360,25000.0,126487.0,126487.0,1/20/2023 3:28,7/30/2024 23:00,8/31/2024 4:00,1725048003,Hardware,San Francisco,True,True,successful,3539582a08,2/27/2025,,Description could not be generated
VH-80A : Auto Calibration Dual Laser Distance Meter,New Era of Distance Measurement | Highest Accuracy with Auto-Calibration Feature | 9 Times Faster Project Speed | Data Management App,2511,10000.0,403437.5,403437.5,12/9/2022 12:49,6/12/2023 22:52,8/11/2023 22:52,1691765565,Gadgets,Wilmington,True,False,successful,35368eb7fb,2/27/2025,,Description could not be generated
LEFEET P1: Versatile Underwater Scooter With Modular Design,Modular Design | Versatility | Wireless Remote | 5lb | 2.3m/s | 1000W | Dual Jet | Scuba | Leg Mount | Foil | SUP | Outboard,364,10000.0,515803.0,515803.0,1/15/2024 12:46,3/6/2024 22:00,4/20/2024 21:00,1713618006,Hardware,Sheridan,True,False,successful,3509b62b67,2/27/2025,,Description could not be generated
Nuwa Pen | AI-powered Ballpoint Pen,Scattered sticky notes and paper? Digitize and organize your handwriting with Nuwa Pen.,743,10000.0,185551.0,204833.4024,4/5/2023 20:05,5/10/2023 1:08,6/8/2023 1:08,1686157724,Gadgets,Groningen,True,False,successful,3501bc49f9,2/27/2025,,Description could not be generated
Introducing the Airdog ADII: The Future is Hands-Free,"The most intelligent, all-terrain, camera drone that follows you in action, anywhere.",256,250000.0,303588.0,303588.0,6/27/2017 5:39,7/12/2017 17:36,8/11/2017 17:36,1502444167,Technology,Palo Alto,True,,successful,34e34c8e4b,2/27/2025,,Description could not be generated
Hobby Hand 2.0 - Prosthetic Hand Robotics Kit,"Learn how to program, use sensors, and micro-controllers!  Join our movement to bring high-functional prostheses to the market!",92,10000.0,13385.07,13385.07,7/9/2015 2:12,9/10/2016 2:52,11/9/2016 3:52,1478634751,3D Printing,Iowa City,True,,successful,34c5f3a905,2/27/2025,,Description could not be generated
"M-One: An opensource, professional desktop DLP 3D printer","The truly personal desktop factory, with high quality details, the simplest design, and opensource for your development.",134,100000.0,180481.33,180481.33,6/13/2014 11:25,6/24/2014 23:30,7/24/2014 23:30,1406215812,3D Printing,Ningbo,True,,successful,34c10db28c,2/27/2025,,Description could not be generated
Bangle.js 2: The Open Smart Watch,"Sunlight readable, 4 week battery life, JavaScript, and tons of free apps",2094,8192.0,176522.0,241306.1989,7/29/2021 21:19,9/22/2021 23:00,10/12/2021 23:00,1634050816,Wearables,Oxford,True,,successful,3408a777ba,2/27/2025,,Description could not be generated
3Dvarius - High-end 3D printed electric Violin,The 3Dvarius is the new electric violin created by 3D printing technology and based on the model of a real Stradivarius violin.,144,50000.0,53231.0,60242.50481,7/21/2015 15:55,5/18/2016 16:19,6/17/2016 16:19,1466151555,3D Printing,France,True,,successful,33f20eef9e,2/27/2025,,Description could not be generated
m!lTone- Portable Air Synth & MIDI controller,"The m!lTone is an open-source synth & MIDI controller.Create music & control video,lights & sound w/ this refreshingly original device.",95,5000.0,14055.0,14055.0,7/18/2013 8:12,8/10/2014 9:41,9/24/2014 9:41,1411522897,Hardware,Austin,True,,successful,338a693967,2/27/2025,,Description could not be generated
OpenTrons: Open-Source Rapid Prototyping for Biology,"Accelerating research with open, affordable, & easy-to-use lab robots. We empower people to innovate with biotech.",237,100000.0,126694.55,126694.55,9/27/2014 6:53,11/1/2014 0:02,12/1/2014 1:02,1417366957,Robots,Brooklyn,True,,successful,337ea683ec,2/27/2025,,Description could not be generated
AIR-INK: The world's first ink made out of air pollution,"At the MIT Media Lab, we invented a device that captures air pollution. We turned this pollution into safe, high-quality ink for art.",688,14000.0,41076.0,29165.21693,11/3/2016 22:30,2/7/2017 21:18,3/9/2017 21:18,1489065522,Technology,Singapore,True,,successful,337491229d,2/27/2025,,Description could not be generated
Meet Doly - Your New Robotic Best Friend,"Your AI-Powered Desktop Companion Meets Skill Development Tools – Fueled by Raspberry Pi, Open Hardware and Open Design",747,8000.0,301597.0,224027.8169,8/3/2023 5:32,2/13/2024 21:55,3/14/2024 14:59,1710399540,Robots,Markham,True,False,successful,335da258b6,2/27/2025,,Description could not be generated
Atlas: A Human-Powered Helicopter for a Historical First!,"A helicopter, powered solely by the pilot, designed to achieve one of the greatest challenges in aviation history: the Sikorsky Prize.",479,30000.0,34424.14,34424.14,5/6/2012 22:05,5/18/2012 9:01,6/17/2012 9:01,1339894918,Flight,Toronto,True,,successful,332d003960,2/27/2025,,Description could not be generated
Philips x Kokoon Sleep Headphones,The ultimate sleep earbuds are here - start your journey to better sleep.,3582,10000.0,548514.0,687478.0637,5/23/2023 0:26,6/14/2023 21:00,7/19/2023 21:00,1689771645,Wearables,London,True,False,successful,32ebb3dab7,2/27/2025,,Description could not be generated
Jewelbots: Friendship Bracelets That Teach Girls To Code,Jewelbots are programmable friendship bracelets that teach girls the basics of coding. An open-source wearable for teens!,1820,30000.0,166945.0,166945.0,7/1/2015 0:59,7/8/2015 23:47,8/7/2015 23:47,1438962478,Wearables,New York,True,,successful,328c8a5422,2/27/2025,,Description could not be generated
Help Us Break A Speed World Record!,MIT reached 34 km/h in 1991. We are designing a human powered watercraft to hit 37 km/h and set a new world record!,80,2000.0,8104.0,7264.578036,9/9/2014 1:36,9/30/2014 9:54,10/30/2014 9:54,1414634050,Technology,Sherbrooke,True,,successful,3227867d35,2/27/2025,,Description could not be generated
GR-1 Granular Synthesizer,"The GR-1 Granular Synthesizer is a hardware musical instrument, offering hands-on controls to create characteristic textures and pads.",117,30000.0,90404.0,108615.8343,7/11/2017 5:18,9/12/2017 22:31,10/3/2017 22:31,1507041116,Sound,Utrecht,True,,successful,315b2d5442,2/27/2025,,Description could not be generated
Try iOS: iPhone App Development Course,Learn how to build iPhone apps by watching videos and coding in your browser.  No downloads needed.,5157,50000.0,152912.53,152912.53,7/6/2012 21:20,7/30/2012 7:01,8/29/2012 7:01,1346194878,Technology,Orlando,True,,successful,314972b570,2/27/2025,,Description could not be generated
"CERAMBOT, The Most Affordable Ceramic 3D Printer","Fast, accurate and easy to use, CERAMBOT makes your ideas take shape",1026,10000.0,286510.99,286510.99,11/1/2018 16:09,11/27/2018 23:59,1/11/2019 23:59,1547222371,3D Printing,Jinan,True,False,successful,30b5521563,2/27/2025,,Description could not be generated
LittleArm: A 3-D Printed Arduino Robot Arm,A low cost desktop robot arm for STEM and hobby projects,71,2000.0,4759.0,4759.0,7/6/2016 7:04,7/20/2016 22:22,8/19/2016 22:22,1471616541,Robots,Boise,True,,successful,309ba2e08f,2/27/2025,,Description could not be generated
Dr. Tan's Supergrams,"A Tangram puzzle that comes to        
 3-D life before your eyes!",79,8000.0,9640.0,9640.0,1/1/2013 3:58,1/8/2013 22:05,2/5/2013 22:05,1360073138,Technology,Boston,True,,successful,30802cfde6,2/27/2025,,Description could not be generated
Bloomengine: The Perfect Home For Your Pet Plant,"Bloomengine allows you to care for your pet plant stress-free by remotely adjusting water, sunlight, and air circulation levels.",295,10000.0,50995.21,50995.21,10/23/2017 12:03,9/18/2018 12:02,11/2/2018 12:02,1541131324,Gadgets,Newport Beach,True,False,successful,3078fa03ae,2/27/2025,,Description could not be generated
Carbon Fiber PLA and More! Performance 3D Printer Filament.,"High performance materials available nowhere else.  Carbon Fiber PLA, High Temperature PLA, and Polycarbonate ABS with datasheets.",500,25000.0,36435.0,36435.0,4/15/2013 12:23,10/26/2013 6:37,11/25/2013 7:37,1385336249,3D Printing,Vancouver,True,,successful,304a7aaccd,2/27/2025,,Description could not be generated
Hypershell: 1 Horsepower Exoskeleton for Everyday Adventure,1 Horsepower Output | 30KG Weight Offset | 25KM Long Range | AI Motion Engine | 1.8KG Ultralight | 20KM/H Speed | 6.5L Size,2638,78500.0,9621027.0,1225629.653,2/25/2023 9:32,3/7/2023 21:59,4/6/2023 20:59,1680785999,Wearables,Hong Kong,True,False,successful,2fdb3f0a8a,2/27/2025,,Description could not be generated
