name,subtitle,backers,goal,pledged,usd_pledged,created_at,launched_at,deadline,state_changed_at,category,location,staff_pick,is_in_post_campaign_pledging_phase,state,campaign_id,scrape_date,days_left,description
"Sphero RVR – The go anywhere, do anything programmable robot","Drive, program, and customize out of the box. Make, build, and expand with 3rd party hardware.",3453,150000.0,1006252.04,1006252.04,1/4/2019 4:50,2/19/2019 19:33,3/22/2019 9:00,1553216400,Robots,Boulder,True,False,successful,c4c7fd047d,2/27/2025,,Description could not be generated
Xiki: The Command Revolution,"Xiki brings the power of shell commands to everyone, and gives advanced shell users insane flexibility.",2490,80000.0,84165.56,84165.56,6/1/2014 11:02,6/10/2014 0:28,7/21/2014 0:28,1405873727,Software,San Francisco,True,,successful,c49a511453,2/27/2025,,Description could not be generated
Robox : Desktop 3D Printer and Micro-Manufacturing Platform,"This is Robox! Designed to be the simplest, most reliable and comprehensive 3D printing platform available. Packed with innovation.",435,100000.0,280891.0,452385.2867,8/5/2013 16:45,11/21/2013 8:03,12/21/2013 8:03,1387584203,3D Printing,Portishead,True,,successful,c45ee6c67e,2/27/2025,,Description could not be generated
Magnetapult - The Magnetic Catapult,Modern super magnets replace the ancient torsion engine in a desktop catapult to get an awesome cubicle warfare machine!,183,5000.0,8513.0,8513.0,12/29/2011 23:39,1/7/2012 23:31,2/6/2012 23:31,1328542282,Hardware,Neche,True,,successful,c42a6b3493,2/27/2025,,Description could not be generated
SB01: Analog Synthesizer of the Future,Iconic sound. Machined aluminum construction. Rechargeable power. All in the thinnest analog synthesizer ever designed.,202,101000.0,177785.0,177785.0,1/2/2019 12:34,10/23/2019 1:34,11/22/2019 2:34,1574361244,Sound,Cambridge,True,False,successful,c41a854e90,2/27/2025,,Description could not be generated
N2 – Writing experience as a pen with digital convenience,"Neo smartpen N2 is a smartpen that writes on paper but also mirrors into smart devices. iOS, Android, Windows compatible. Support us!",2243,20000.0,359112.0,319016.9872,9/16/2014 13:35,9/25/2014 8:33,10/16/2014 23:00,1413471611,Technology,Sydney,True,,successful,c40b185bdf,2/27/2025,,Description could not be generated
Kolibree: The World's First Connected Electric Toothbrush,Kolibree transforms the way you brush your teeth. Connect to any iOS or Android device to enable FEEDBACK and gaming experiences.,816,70000.0,108683.52,108683.52,3/20/2014 5:04,4/10/2014 23:01,5/25/2014 23:01,1401030121,Technology,New York,True,,successful,c3f9eb14b2,2/27/2025,,Description could not be generated
Rhode Island Mini Maker Faire 2013,"Rhode Island's own celebration of New England innovation, ingenuity, and invention.",66,2000.0,2266.0,2266.0,7/11/2013 8:55,7/13/2013 11:30,8/8/2013 11:59,1375934342,Technology,Providence,True,,successful,c3ed5e5fe0,2/27/2025,,Description could not be generated
Low Voltage Metal Sensor for use with Arduino type boards,"Low Voltage Metal Sensor directly compatible with Arduino type computers for Robotics, & Motor Control, WITHOUT USING MAGNETS!",122,1500.0,2885.0,2885.0,2/18/2014 7:55,4/8/2014 10:20,5/15/2014 7:04,1400108640,Hardware,Philadelphia,True,,successful,c3db7b0fc6,2/27/2025,,Description could not be generated
"SwitchBot Blind Tilt, solar-powered retrofit smart blinds.","Simple Setup | Solar Powered | Compatible with Alexa, Google Home and Siri | Light Sensing Controls",1825,30000.0,357390.0,357390.0,9/16/2022 19:46,10/21/2022 22:56,11/20/2022 22:59,1668956341,Gadgets,United,True,False,successful,c3bc1c79aa,2/27/2025,,Description could not be generated
CrowView Note: Empowering Your Device as a Laptop,All-in-One Portable Monitor丨Phone-to-Laptop丨SBCs/Mini PC/PC/Game Console Compatibility丨Full-Featured Type-C丨Built-in 5000mAh battery,1538,77815.0,2108440.0,270357.8184,7/23/2024 12:10,8/13/2024 22:00,9/14/2024 9:00,1726275602,Hardware,Hong Kong,True,False,successful,c3aa7a7bf0,2/27/2025,,Description could not be generated
Looking Glass Go,Your first portable holographic display for spatial memories.,2365,50000.0,680940.72,680940.72,10/3/2023 1:07,12/5/2023 20:54,1/16/2024 20:54,1705409690,Hardware,Brooklyn,True,False,successful,c384cf650e,2/27/2025,,Description could not be generated
Outisan e-Wagon: Electric Utility Wagon with Power Assist,Uphill Power Assist | Downhill Speed Control | Smart Handle System | All-terrain Wheels｜Detachable Battery and more...,350,100000.0,1608084.0,204863.212,8/24/2022 15:00,9/15/2022 23:40,11/15/2022 0:40,1668444039,Hardware,Hong Kong,True,False,successful,c35bc1641a,2/27/2025,,Description could not be generated
"RingConn Gen 2: Ultimate Lightness, 12 Days Battery",Next-Gen Smart Ring: AI-Powered Sleep Health Tracking| Thinnest & Lightest| 12-Day Battery Life| IP68| iOS/Android| No Subscription Fee,18428,50000.0,4415966.0,4415966.0,7/5/2024 14:44,8/1/2024 23:43,9/15/2024 23:43,1726415013,Wearables,Wilmington,True,False,successful,c337c4c3e0,2/27/2025,,Description could not be generated
bassAware Holster,The bassAware Holster is a new type of wearable audio technology that uses vibration to create a massive bass experience.,191,30000.0,37104.03,37104.03,4/2/2013 2:46,9/19/2013 3:30,10/16/2013 11:59,1381895942,Hardware,New York,True,,successful,c30b902488,2/27/2025,,Description could not be generated
"Bring Reading Rainbow Back for Every Child, Everywhere!",Bring Reading Rainbow’s library of interactive books & video field trips to more platforms & provide free access to classrooms in need!,105857,1000000.0,5408916.95,5408916.95,4/23/2014 11:00,5/28/2014 21:05,7/3/2014 3:00,1404327611,Web,Los Angeles,True,,successful,c2c76281cc,2/27/2025,,Description could not be generated
Tiny Bluetooth Sensors so you can MAKE and CONNECT Stuff,"Temp, Light, and 10 axis of Motion sensing (gyro+mag+baro) for Sports, Wearables, and Education; this is the most advanced BLE SENSOR.",597,5000.0,53432.0,53432.0,12/17/2015 4:03,1/26/2016 22:54,2/25/2016 22:54,1456412045,DIY Electronics,San Francisco,True,,successful,c2c311634e,2/27/2025,,Description could not be generated
CLIP⚡Portable e-motor to Transform any bike into an e-bike,"Attach CLIP to bike to ride effortlessly. Detach, after parking to recharge CLIP on your desk.",157,10000.0,16572.0,16572.0,12/7/2018 2:05,3/20/2019 12:54,4/19/2019 12:54,1555649697,Hardware,Brooklyn,True,,successful,c2aee43f63,2/27/2025,,Description could not be generated
Polaris - Smart Electric Tripod Head,"A Smart Electric Tripod Head with Camera Interface Controller, Remote DSLR Preview & Configuration through WiFi/Cellular",3600,200000.0,20803552.0,2683204.066,1/19/2021 14:54,2/3/2021 22:58,3/15/2021 21:58,1615816720,Camera Equipment,Kowloon,True,False,successful,c2aeb0c886,2/27/2025,,Description could not be generated
"Open Source, Ultra-Bright LED Lumapad with WiFi & Arduino","Open source, 8000 lumen, ultra bright LED light pad with Electric IMP WIFI, Atmel AVR & Arduino micro controller built in.",225,28000.0,94482.0,94482.0,11/13/2012 7:43,2/8/2013 8:29,4/9/2013 7:29,1365463763,Hardware,Los Angeles,True,,successful,c2971e9c3c,2/27/2025,,Description could not be generated
Bird Buddy: The Summer of Birds,"A Smart Hummingbird Feeder & Smart Bird Bath that identify and capture stunning, up-close photos and videos of your backyard visitors.",10134,100000.0,3139884.0,3139884.0,3/28/2023 20:53,5/16/2023 21:55,6/15/2023 21:55,1686837335,Gadgets,Kalamazoo,True,False,successful,c27607be9c,2/27/2025,,Description could not be generated
Flotilla for Raspberry Pi - Friendly Electronics,"Build your next great idea in minutes, not hours. Hassle-free digital tinkering for everyone with Flotilla for Raspberry Pi!",1508,32768.0,146680.0,222713.8354,5/22/2014 3:07,1/17/2015 17:21,2/16/2015 17:21,1424078514,DIY Electronics,Sheffield,True,,successful,c25c4465d5,2/27/2025,,Description could not be generated
CircuitMess STEM Box,Learn the skills of the future with electronic projects delivered to your doorstep,2001,15000.0,408749.5,408749.5,6/12/2020 6:26,6/29/2020 16:00,8/18/2020 16:00,1597737628,DIY Electronics,Zagreb,True,False,successful,c1f69f2d22,2/27/2025,,Description could not be generated
The Nomad CNC Mill,The Nomad 883 is a ready-to-run CNC Mill that's at home in any environment.,363,30000.0,513665.25,513665.25,4/1/2014 10:44,4/30/2014 6:47,5/31/2014 3:00,1401476410,Hardware,El Segundo,True,,successful,c1deb0fb8e,2/27/2025,,Description could not be generated
KADE - Connects arcade controls to computers and consoles,Easily connect arcade controls to your favourite consoles and computers with our ground breaking open source device.,229,750.0,6577.0,10533.98681,11/21/2012 7:29,12/1/2012 1:39,12/24/2012 6:00,1356300032,Technology,Hull,True,,successful,c1d9e5714a,2/27/2025,,Description could not be generated
Ototo: Make Music from Anything,Ototo is an all-in-one musical invention kit which allows you to make an instrument any way you want.,915,50000.0,73589.0,121851.4251,1/10/2014 0:48,1/31/2014 19:49,3/3/2014 3:00,1393786818,Sound,London,True,,successful,c18062f83b,2/27/2025,,Description could not be generated
Carvera Air: A Smart and Versatile Desktop CNC,Endless Materials | Quick Tool Changer | Auto Probing and Leveling | 4th Axis | Laser Engraving | All-in-one CAM Software,2098,50000.0,3469320.0,3469320.0,3/19/2024 20:56,4/9/2024 22:59,5/10/2024 22:59,1715353205,Fabrication Tools,Beijing,True,False,successful,c15664ceaf,2/27/2025,,Description could not be generated
MOUTHBREATHER FUZZ,Help fund the initial run of Totally Ruined Circuits hand wired and hand painted effects pedals.,82,500.0,6114.84,6114.84,2/28/2013 13:32,3/2/2013 9:22,3/16/2013 8:22,1363393322,Technology,Port Chester,True,,successful,c142649991,2/27/2025,,Description could not be generated
PicoBricks for Micro:Bit - Your Programmable STEM Playground,"Dream, Code, Play - Educational Electronic Robotic Kits for Everyone to STEM",435,10000.0,65390.0,65390.0,9/5/2023 15:46,1/31/2024 0:00,3/15/2024 23:00,1710514832,DIY Electronics,San Francisco,True,False,successful,c140c88634,2/27/2025,,Description could not be generated
Lumos - A Next Generation Bicycle Helmet,The ultimate bicycle helmet with brake lights and turn signals to help cyclists stay safe and visible on the road.,6072,125000.0,809551.0,809551.0,10/8/2014 2:35,7/14/2015 22:52,8/13/2015 22:52,1439477552,Technology,Boston,True,False,successful,c133a83555,2/27/2025,,Description could not be generated
Planty: The Smart Way to Connect with Nature,No more dead plants. Planty is an Internet-connected planter that allows you to monitor and water plants on-the-go via the mobile app.,500,100000.0,103127.0,103127.0,12/15/2014 14:37,4/8/2015 21:00,5/23/2015 21:00,1432386021,Hardware,New York,True,,successful,c0ffa8c1ad,2/27/2025,,Description could not be generated
"M-Cube 02 Anti-Gravity Laser Level: Align, Measure, Position","Defy gravity, level and measure simultaneously, and lock the ideal position with ease — leveling experience redefined.",1380,30000.0,3164879.0,407563.623,7/29/2024 13:25,10/8/2024 21:00,11/22/2024 22:00,1732284020,DIY Electronics,Hong Kong,True,False,successful,c0662f407f,2/27/2025,,Description could not be generated
Raspberry Pi Gamer Console,"The cumulated works of greats neatly under your TV: The ability to play Super Nintendo, NES, Sega Games with simplicity and ease.",414,2800.0,35525.0,35525.0,7/25/2014 2:08,7/29/2014 23:26,8/28/2014 23:26,1409239574,Hardware,Williamsburg,True,,successful,c00424c745,2/27/2025,,Description could not be generated
Bieree: Smart-phone beer brewing,Don't waste your valuable time and money.  Watch the game while you brew.  Personalize and share your brew experience.,57,6000.0,6363.0,6363.0,4/13/2013 22:30,7/14/2014 8:08,8/13/2014 8:08,1407888501,Hardware,Dallas,True,,successful,bfa5774d52,2/27/2025,,Description could not be generated
My First Modular,"""My First Modular"" is a low-cost eurorack system designed to be the gateway to modular synths",62,157000.0,413959.8,23493.30322,9/27/2023 1:58,11/15/2023 14:00,12/18/2023 20:00,1702900800,Sound,Mexico,True,,successful,bf62def15d,2/27/2025,,Description could not be generated
Fosi Audio VOL20 - Multimedia Control Knob with RGB light,"Built with zinc alloy, VOL20 offers Bluetooth/USB connectivity, customizable RGB lighting, and plug-and-play ease for volume control",473,10000.0,161906.0,20773.61971,2/19/2024 12:20,9/19/2024 18:51,10/19/2024 18:51,1729335101,Gadgets,Hong Kong,True,False,successful,bf5bbe7c6e,2/27/2025,,Description could not be generated
Bukobot 3D Printer - Affordable 3D with No Compromises!,"An easy to build open source 3D object printer. For the newbie or experienced maker, there's a model for everyone! NEW $599 Model!",290,42000.0,167410.02,167410.02,3/13/2012 16:23,4/21/2012 14:31,5/24/2012 3:00,1337799618,Hardware,Pasadena,True,,successful,bf51d4f2ac,2/27/2025,,Description could not be generated
Mono - The future of DIY devices,"Avoid stranded projects. Mono is an Arduino-compatible programmable gadget with touch display, wireless and battery.",855,500000.0,626718.0,105686.897,9/16/2014 3:21,11/18/2014 20:59,12/18/2014 20:59,1418907616,Hardware,Copenhagen,True,,successful,bef8a1f132,2/27/2025,,Description could not be generated
"SenseCAP T1000, track what you care with no boundaries","Whether it's locations or status of valuable assets or personnel, from indoors to outdoor remote places, T1000 has got you covered!",946,20000.0,105217.0,105217.0,7/25/2023 13:45,8/22/2023 23:00,9/9/2023 23:59,1694275140,Hardware,Santa Clara,True,False,successful,bec8185ff7,2/27/2025,,Description could not be generated
Sherlybox - turn your public clouds into private & unlimited,"The easiest way to share files. It works like a cloud, but data stays on your own drives. Make a folder and invite friends to share it",896,69000.0,154106.36,154106.36,4/9/2014 19:56,6/4/2014 15:00,7/4/2014 15:00,1404457234,Hardware,Palo Alto,True,,successful,bec2ed832a,2/27/2025,,Description could not be generated
Bring Stargazing to the Bronx!,Help the Amateur Astronomers Association launch the first free public observatory in The Bronx in over 150 years!,194,20000.0,20696.0,20696.0,2/14/2023 13:32,7/10/2023 21:00,9/8/2023 21:00,1694178003,Space Exploration,Bronx,True,,successful,be8fc698a7,2/27/2025,,Description could not be generated
Bangle.js: the hackable Smart Watch,"An open source, AI-enabled smart watch that can be easily customised",1345,12500.0,101516.0,129686.6677,10/23/2019 17:12,11/11/2019 15:58,11/29/2019 1:30,1574962200,Gadgets,Oxford,True,,successful,be4ebdd69a,2/27/2025,,Description could not be generated
"Neovide, Waterless One-Stop Sous Vide Cooker","No more water containers and vacuum bags. With Neovide, making perfect sous vide food at home is effortless.",984,10000.0,446860.0,318133.8263,6/30/2022 17:28,9/6/2022 21:00,10/6/2022 21:00,1665061204,Technology,Singapore,True,False,successful,be3c051d9c,2/27/2025,,Description could not be generated
Bird Buddy: A Smart Bird Feeder,"Bird Buddy notifies you of feathered visitors, captures their photos and organizes them in a beautiful collection!",22925,50000.0,4190158.0,4969181.574,10/31/2020 16:03,11/18/2020 23:57,1/15/2021 6:00,1610661601,Gadgets,Ljubljana,True,False,successful,bc89e58c9f,2/27/2025,,Description could not be generated
The Keyboardio Model 100,"A customizable ergonomic, mechanical keyboard that works the way you do",2569,100000.0,901653.0,901653.0,11/3/2020 0:31,6/29/2021 22:00,7/31/2021 14:59,1627714742,Hardware,Oakland,True,False,successful,bc3a9836b0,2/27/2025,,Description could not be generated
Bocusini - World's first plug & play 3D Food Printing System,"3D Food Printer or food printing head, cartridges with printable food, intuitive WIFI user interface and supporting internet platform",149,30000.0,40581.0,45283.86513,4/28/2015 20:51,5/12/2015 15:42,6/11/2015 15:42,1434008565,3D Printing,Munich,True,,successful,bc21592a1f,2/27/2025,,Description could not be generated
"/Crowdring, a mobile organising tool",What if people around the world could sign a petition for free using any  mobile phone?,206,15000.0,15252.93,15252.93,1/26/2013 20:07,2/11/2013 20:41,3/17/2013 12:00,1363492833,Software,Nairobi,True,,successful,bc1b9db2c6,2/27/2025,,Description could not be generated
VEST: A Sensory Substitution Neuroscience Project,Help our neuroscientific project to expand human perception. We're making a wearable device to let brains take in new data streams.,288,40000.0,47285.1,47285.1,9/9/2014 0:07,9/9/2014 0:44,10/9/2014 0:44,1412786712,Wearables,Houston,True,,successful,bc0a45ef52,2/27/2025,,Description could not be generated
ChainDuino,Have you ever wanted to connect lots of Arduino boards using just Cat5?  Now you can.  Arduino + PoE + RS485 = ChainDuino,146,2500.0,12190.0,12190.0,7/9/2014 8:57,7/24/2014 19:39,8/30/2014 13:00,1409374810,Hardware,Boston,True,,successful,bb64cabcfc,2/27/2025,,Description could not be generated
"Timelapse+ : powerful features, brilliant timelapse","Timelapse+ : Powerful, flexible, extendable, yet easy-to-use intervalometer for timelapse photography and more",1248,20000.0,165730.01,165730.01,12/24/2011 6:20,12/31/2011 23:36,2/19/2012 13:59,1329631141,Technology,Minneapolis,True,,successful,bb490ee64e,2/27/2025,,Description could not be generated
FlameShip - 3D Electric Steam Fireplace,Absolute safety. Maximum flame realism. 5 operating modes. Unique design.,1204,12000.0,268010.0,293138.4112,5/12/2023 1:00,6/21/2023 1:27,7/22/2023 1:27,1689960443,Gadgets,Krakow,True,False,successful,bae33eed9b,2/27/2025,,Description could not be generated
OpenCV AI Kit - Lite (and Tiny),"Spatial AI Made Easy, Tiny and Affordable - From the Biggest Name in Computer Vision",7988,20000.0,1028843.88,1028843.88,8/5/2021 6:46,9/15/2021 21:00,10/16/2021 21:00,1634389210,Robots,Boulder,True,,successful,baa84862e4,2/27/2025,,Description could not be generated
GPS AdventureBox - give the gift of fun and adventure,This Arduino based project allows the giver to send the recipient on a fun and/or romantic journey in order for the gift box to unlock.,348,5000.0,39376.14,39376.14,4/13/2011 9:10,12/21/2013 6:52,1/20/2014 6:52,1390171963,Technology,Camarillo,True,,successful,ba96360921,2/27/2025,,Description could not be generated
"Dark Sky - Weather Prediction, Reinvented",Down-to-the-minute weather prediction for your exact location. Accompanied by stunning high-resolution radar animations.,1203,35000.0,39376.72,39376.72,9/27/2011 5:50,10/27/2011 0:53,12/1/2011 1:53,1322675608,Apps,Troy,True,,successful,b9eef74adf,2/27/2025,,Description could not be generated
Meld: A Perfect Meal Every Time,Meld upgrades your existing cookware and stove with automatic temperature control so every meal is perfect,1550,50000.0,209688.01,209688.01,3/29/2015 6:07,4/7/2015 19:46,5/9/2015 8:00,1431129612,Gadgets,Seattle,True,,successful,b9d45da4df,2/27/2025,,Description could not be generated
MOON - the most accurate lunar globe,"The first topographically accurate lunar globe, displaying the current lunar phases at any given time.",541,25000.0,145393.0,206974.8478,11/14/2015 1:38,4/13/2016 21:00,5/13/2016 21:00,1463144418,Technology,London,True,,successful,b97574f3a4,2/27/2025,,Description could not be generated
Cardboard Robot: open smart phone camera crane & robotic arm,Open Source. Huge (span of nearly 6 feet) computer-controlled robot arm/camera crane. Clean up your room or take cool videos.,122,10000.0,12183.0,12183.0,6/26/2012 17:09,7/6/2012 15:23,8/20/2012 15:23,1345447412,Robots,Saratoga Springs,True,,successful,b8e861d767,2/27/2025,,Description could not be generated
GoFar: The First Gadget That Improves Your Driving,"Awesome car computer. Better mileage. Lower emissions.
A beautiful device that improves your driving.",1208,50000.0,160150.0,160150.0,4/1/2015 17:08,5/4/2015 11:10,6/3/2015 11:10,1433301027,Gadgets,San Francisco,True,,successful,b8dad3e83b,2/27/2025,,Description could not be generated
The World's First HomePod,"Your content at home in any room. Surfaces become large screens, music follows you, wirelessly: the first genuine ""home"" computer.",294,100000.0,260574.0,260574.0,2/14/2014 0:13,10/14/2014 23:45,11/19/2014 0:45,1416329129,Hardware,Redwood City,True,,successful,b88d74e287,2/27/2025,,Description could not be generated
HiChord - Pocket Chord Synthesizer,"Write songs anywhere. Instantly playable, deeply featured. Play chords with one button.",795,30000.0,287134.0,210360.2805,3/4/2024 1:34,4/30/2024 19:58,6/14/2024 19:58,1718366306,Sound,Toronto,True,False,successful,b82488d9db,2/27/2025,,Description could not be generated
On the Salt: Kent Fuller's Last Car,Legendary chassis fabricator KENT FULLER is building the last car of an illustrious career - a STREAMLINER to break land speed records,282,32900.0,35957.43,35957.43,1/16/2013 10:56,3/24/2013 5:11,5/23/2013 5:11,1369257116,Technology,Los Angeles,True,,successful,b821396928,2/27/2025,,Description could not be generated
OpenROV Trident - An Underwater Drone for Everyone,The future of ocean exploration is here.,1324,50000.0,815601.5,815601.5,8/13/2015 1:41,9/14/2015 23:59,10/31/2015 14:59,1446274740,Robots,San Francisco,True,,successful,b80ad50778,2/27/2025,,Description could not be generated
Keychron K2 HE: Ultimate Customizable Magnetic Keyboard,Hall Effect Magnetic Switches | Wireless 2.4G & Bluetooth | Custom Actuation Points | Rapid Trigger | QMK | For Mac & Windows | Wooden,6608,20000.0,1177319.0,1177319.0,7/23/2024 16:09,8/7/2024 23:31,9/13/2024 20:00,1726228800,Gadgets,Beverly Hills,True,False,successful,b7e47da340,2/27/2025,,Description could not be generated
CHIP - The World's First Nine Dollar Computer,"Built for work, play, and everything in between!       \(•◡•)/",39560,50000.0,2071927.56,2071927.56,4/17/2015 3:36,5/7/2015 23:06,6/6/2015 23:06,1433603163,Hardware,Oakland,True,,successful,b7e1572b37,2/27/2025,,Description could not be generated
DIWire: The First Desktop Wire Bender,The DIWire transforms drawn curves into bent wire that can be assembled to make just about anything.,288,100000.0,177522.0,177522.0,9/27/2013 22:15,11/12/2013 22:10,12/17/2013 22:10,1387289458,Hardware,Brooklyn,True,,successful,b742c1e860,2/27/2025,,Description could not be generated
A Hackerspace Grows in Brooklyn.,"NYC Resistor is a creative technology space in Brooklyn where we learn, share, and make things. We're moving to a great new location wtih 3x the space",46,2000.0,3000.96,3000.96,1/21/2010 4:22,1/21/2010 5:57,2/16/2010 4:22,1266265807,Software,New York,True,,successful,b73c24a261,2/27/2025,,Description could not be generated
iMicro Q3 - A Fingertip Microscope toward the Optical Limit,"Super 700nm resolution, 1200x magnification, 1/2 inch 1/60 oz, explore the microworld with any smartphone at an affordable cost.",7060,13625.0,473320.29,346965.2566,7/19/2023 16:05,10/17/2023 21:59,12/16/2023 22:59,1702738786,Gadgets,Shanghai,True,False,successful,b72ffdc25e,2/27/2025,,Description could not be generated
EyeRide HUD : Make Your Helmet Smart.,"Augment your helmet with GPS, Music, and Calls.
Ride Safe with our HEAD-UP DISPLAY add on.",2720,11512.0,827138.0,913652.6894,10/3/2019 18:13,3/4/2020 0:29,4/2/2020 23:29,1585841371,Wearables,Toulouse,True,False,successful,b7014a3c03,2/27/2025,,Description could not be generated
L'Oréal Paris's At-Home Hair Color Device - Colorsonic,"Fast, easy, mistake-free hair color at the press of a button",316,39000.0,42253.0,42253.0,5/7/2024 0:29,5/12/2024 21:34,5/26/2024 21:34,1716730453,Technology,New York,True,False,successful,b6c81aa3da,2/27/2025,,Description could not be generated
The Every Day Calendar,A personal gold star system for your habits,2305,35000.0,593352.09,593352.09,9/6/2018 6:24,10/23/2018 22:59,11/22/2018 23:59,1542902364,Technology,San Francisco,True,False,successful,b6c4465227,2/27/2025,,Description could not be generated
"MOD Dwarf: The smart, compact and powerful pedal brain","Unprecedented patching freedom, new plugins every month, and plenty of power to use as many simultaneous plugins as you wish.",798,100000.0,212667.0,230137.6706,1/29/2020 8:49,2/25/2020 20:59,4/2/2020 19:59,1585828753,Sound,Berlin,True,,successful,b68eabc0bf,2/27/2025,,Description could not be generated
Magnic Microlights: Smallest contactless dynamo bike lights,"Bicycle lights in brake shoes powered by eddy current generators: no mechanical friction, cables or wheel magnets. With newest Cree LED",1129,70000.0,109264.0,124398.1555,2/16/2018 2:40,11/7/2018 2:00,12/22/2018 5:00,1545426000,Technology,Borgholzhausen,True,False,successful,b658e84317,2/27/2025,,Description could not be generated
Modal Electronics SKULPT synthesiser,"SKULPT synthesiser, a 4 voice, 32 oscillator polyphonic portable synth that proves you don't have to be big to sound BIG.",576,50000.0,148683.0,196246.7318,7/6/2018 22:47,7/13/2018 20:43,8/12/2018 20:43,1534077796,Sound,Bristol,True,,successful,b6164049a3,2/27/2025,,Description could not be generated
"SpectraSaber - Multicolor, UltraBright, Scrolling Lightsaber",A new LED Light Saber using the latest electronic technologies and equipped with multiple high-end features.,49,10000.0,23706.0,23706.0,5/29/2012 23:01,6/20/2016 10:46,7/18/2016 10:00,1468807201,Technology,Los Angeles,True,,successful,b5f3ae4170,2/27/2025,,Description could not be generated
Let's Add a Million Missing Words to the Dictionary,Let's give a million missing words their rightful places in the dictionary.,726,50000.0,58407.36,58407.36,7/9/2015 7:29,9/15/2015 23:08,10/17/2015 14:59,1445065141,Web,Millbrae,True,,successful,b5e4eee067,2/27/2025,,Description could not be generated
