name,subtitle,backers,goal,pledged,usd_pledged,created_at,launched_at,deadline,state_changed_at,category,location,staff_pick,is_in_post_campaign_pledging_phase,state,campaign_id,scrape_date,days_left,description
Slice : A media player and more,"The user friendly media player with internal storage and a Raspberry Pi heart. Load it with anything, use it anywhere.",1509,90000.0,227480.0,381602.2996,6/3/2014 17:04,8/12/2014 5:00,9/26/2014 5:00,1411678810,Gadgets,Sheffield,True,,successful,ff7eadddb7,2/27/2025,,Description could not be generated
Snapmaker 2.0: Modular 3-in-1 3D Printers,"Unlock your full creative potential from 3D printing to laser engraving, cutting and CNC carving. Smarter, larger, and more powerful.",7388,100000.0,7850866.96,7850866.96,4/24/2019 14:56,5/7/2019 22:00,6/6/2019 22:00,1559829638,3D Printing,New Castle,True,,successful,ff2fc2eaa9,2/27/2025,,Description could not be generated
EXTRAORDINARY: Making the world a better place (free app!),"STAFF PICK: Every time you eat out, go shopping or do something fun, you help employ someone in need to plant a tree.",117,10000.0,10056.0,9307.439807,7/29/2014 4:18,7/31/2014 10:10,9/5/2014 14:59,1409900343,Apps,San Francisco,True,,successful,ff24b62c58,2/27/2025,,Description could not be generated
Arcano MIDI NES Chiptune Synthesizer,The Arcano MIDI NES Chiptune Synthesizer is an AVR-based MIDI synth that allows musicians to create Nintendo style chiptune music.,171,1000.0,14534.8,14534.8,7/26/2015 4:22,7/29/2015 22:43,8/27/2015 1:30,1440610213,Sound,Orlando,True,,successful,fe905ab501,2/27/2025,,Description could not be generated
Vespera: The new way to observe the universe,The world's most compact and powerful exploration station,2163,10000.0,2559952.0,2559952.0,9/8/2020 18:17,10/1/2020 21:17,10/31/2020 19:59,1604145540,Space Exploration,New York,True,False,successful,fe7e1025c6,2/27/2025,,Description could not be generated
The Magic Wheelchair,The Mission: Build 5 Epic Wheelchair Costumes for Kids for Halloween 2015!,769,15000.0,25688.0,25688.0,4/18/2015 6:26,6/3/2015 23:02,7/3/2015 23:02,1435935774,Technology,Portland,True,,successful,fe6c5d9ed7,2/27/2025,,Description could not be generated
ODIN: Android 'Smart' Projector to Carry in Your Pocket,First Mobile Device Focused on Social Interaction.  Battery and Android Powered to Provide Visual and Sound Anywhere.,561,250000.0,268192.0,268192.0,4/5/2014 3:22,5/28/2014 19:54,7/8/2014 11:59,1404791941,Hardware,New York,True,,successful,fe221e884d,2/27/2025,,Description could not be generated
The HyperCube Nano,"Infinite luminous architecture in a sleek, portable, affordable form.",1498,100000.0,304029.0,304029.0,3/26/2022 14:24,5/10/2022 21:55,6/11/2022 15:00,1654930800,Gadgets,San Diego,True,False,successful,fdd0ab1338,2/27/2025,,Description could not be generated
Gameduino: an Arduino game adapter,Gameduino brings glorious 8-bit arcade action to the Arduino,471,3333.33,38297.77,38297.77,2/23/2011 8:44,2/28/2011 22:05,4/1/2011 21:05,1301663104,DIY Electronics,Pescadero,True,,successful,fd88a3919f,2/27/2025,,Description could not be generated
HearNotes Premium WireFree Earbuds - The Universal Edition,"Finally, truly wireFREE earbuds have arrived! HearNotes WireFree Earbuds w/ Kleer technology delivers HI-FI stereo music with NO WIRES!",514,75000.0,124155.0,124155.0,3/26/2015 6:30,5/4/2015 11:45,6/8/2015 11:45,1433735141,Wearables,San Francisco,True,,successful,fd583e37ff,2/27/2025,,Description could not be generated
"AttoDuino - Turbocharged, Wireless, Arduino Compatible","It's like an Arduino on steroids – built-in bluetooth, battery management, and floating-point coprocessor, in a small, simple package.",306,10000.0,19292.5,19292.5,3/21/2014 6:32,4/14/2014 2:43,5/14/2014 2:43,1400006636,Hardware,Oakland,True,,successful,fcfd159776,2/27/2025,,Description could not be generated
Beam: The smart projector that fits in any light socket,"The smart projector that assists you in your daily activities, controlled with your smartphone or tablet. Screw it in and have fun!",1973,200000.0,759656.0,759656.0,1/7/2015 4:54,2/17/2015 23:35,3/24/2015 22:35,1427207714,Gadgets,Los Angeles,True,,successful,fcca4dd519,2/27/2025,,Description could not be generated
Bridge6: Next-gen MIDI foot controller,"An affordable MIDI foot controller with no compromises. RGB LEDs, OLED screen, silent switches, USB C, config app + more!",275,27500.0,89300.32,65730.38818,9/23/2020 8:57,11/28/2020 7:59,1/1/2021 14:30,1609482600,Sound,Newcastle,True,,successful,fbf2aae0c6,2/27/2025,,Description could not be generated
Triggertrap Ada: Modular Camera Trigger,"Ada is an infinitely expandable camera trigger, making high-speed, camera trap, and timelapse photography affordable for everyone.",1971,50000.0,290386.0,463933.2067,7/30/2013 0:14,10/15/2013 20:46,11/16/2013 3:30,1384543818,Camera Equipment,London,True,,successful,fb54aed94f,2/27/2025,,Description could not be generated
ACPAD – The Electronic Orchestra For Your Guitar,"Play hundreds of instruments, samples, effects and loops – on your acoustic guitar. ACPAD puts an electronic orchestra in your hands!",1204,40000.0,296922.0,337263.4263,9/23/2015 3:34,10/22/2015 19:04,12/4/2015 12:59,1449205140,Technology,Berlin,True,,successful,fb3c7878f0,2/27/2025,,Description could not be generated
Darkmatter Xbox Laptop and DIY Kit,Darkmatter is the world's first Xbox(tm) laptop that you can buy as a fully assembled product or in kit form. Now Xbox ONE compatible!,110,25000.0,29716.0,29716.0,12/17/2012 22:36,5/19/2013 1:54,6/18/2013 1:54,1371491696,Hardware,Austin,True,,successful,fb06220a90,2/27/2025,,Description could not be generated
Tidbyt: The Retro Display from the Future,"Tidbyt is a lo-fi smart display that gives you weather, stocks, transit, and a whole lot more.",5106,40000.0,918844.1,918844.1,1/29/2021 0:44,3/16/2021 21:03,4/16/2021 1:00,1618506000,Technology,Brooklyn,True,False,successful,fadb79921d,2/27/2025,,Description could not be generated
iheart poetics : a visual poetry app for iPhone,An application enabling the creation and sharing of interactive visual poems that merge moveable text with photographs and imagery,126,19000.0,19339.0,19339.0,11/9/2011 12:11,11/23/2011 4:20,12/30/2011 4:20,1325190032,Apps,New York,True,,successful,fad130cbe6,2/27/2025,,Description could not be generated
Wearality Sky: Limitless Virtual Reality (VR),"Explore the limitless possibilities of the Sky. The next generation of VR wearables is here, with an astonishing 150 degrees FOV.",1091,100000.0,117650.0,117650.0,3/4/2015 4:59,4/6/2015 20:52,5/6/2015 20:52,1430916760,Wearables,San Francisco,True,,successful,fa68bb9d4c,2/27/2025,,Description could not be generated
TMICE X - Control Your Workflow with Modular Keyboard,Multifunctional Main Keyboard / Customizable Numpad / Customizable Macro Pad / Docking Station / Hot-Swappable / Productivity / Creator,130,77701.0,288420.0,37141.86234,8/8/2024 15:14,10/8/2024 20:09,11/7/2024 21:09,1730984963,Hardware,Hong Kong,True,False,successful,fa52aa0eec,2/27/2025,,Description could not be generated
Robot Core - The Ultimate Raspberry Pi Robot Controller,"Robot Core is a robot controller that connects to the Raspberry Pi, allowing you to easily control motors, servos, and read sensors.",148,13300.0,13300.0,13300.0,12/5/2016 10:50,2/18/2017 4:43,3/20/2017 3:43,1489952587,Robots,St. Louis,True,,successful,f9bb1fa463,2/27/2025,,Description could not be generated
AnyMote Home + Your Phone = The Ultimate Universal Remote,"AnyMote turns your smartphone into the next generation universal remote! Control and automate your TV, computer, sound system, & more!",1692,50000.0,151436.0,151436.0,7/17/2014 1:52,8/25/2014 22:47,10/10/2014 22:47,1412952456,Hardware,Palo Alto,True,,successful,f8f3b6592a,2/27/2025,,Description could not be generated
Skirmos: Open Source Laser Tag,The most advanced open source laser tag system. Create your own indoor or outdoor battlefield. Build your own custom gametypes.,471,60000.0,98674.31,98674.31,8/24/2013 5:05,2/27/2014 21:01,4/4/2014 20:01,1396612868,Hardware,Washington,True,,successful,f8e1a3e575,2/27/2025,,Description could not be generated
BioLite BaseCamp Stove | Turn Fire into Electricity,"We heard you, it's here: advanced off-grid cooking and charging for groups, powered by wood. Can your stove do that?",3783,45000.0,1032443.68,1032443.68,4/30/2014 23:40,5/14/2014 12:02,6/16/2014 11:59,1402891140,Technology,Brooklyn,True,False,successful,f82be92319,2/27/2025,,Description could not be generated
PowerUp FPV - Live Streaming Paper Airplane Drone,"Experience first-person-view flight on a paper airplane with a LIVE streaming camera, via Google Cardboard.",2537,100000.0,492204.0,492204.0,10/11/2015 17:16,11/11/2015 0:01,1/10/2016 0:01,1452355281,Flight,New York,True,,successful,f78832660b,2/27/2025,,Description could not be generated
Moviesandbox - an open-source 3D animation tool,"Moviesandbox is an Open-Source, Real-Time 3D Animation tool. It allows you to quickly sketch and animate 3D Characters and Props.",108,4200.0,5466.0,5466.0,3/25/2011 1:37,3/30/2011 5:08,5/10/2011 4:59,1304974740,Software,Somerville,True,,successful,f71347136b,2/27/2025,,Description could not be generated
"Danish design, tech & power in new Bluetooth speaker","80 hours battery, 125 dB & an app to connect multi-users, multi-speakers and phone as microphone.",155,100000.0,121306.0,140138.6764,3/12/2021 21:28,10/14/2021 15:59,11/13/2021 16:59,1636793959,Gadgets,Copenhagen,True,,successful,f667d88d73,2/27/2025,,Description could not be generated
Dockcase Smart Magsafe M.2 NVMe SSD Enclosure,For 2230/2242 SSD | 4K ProRes Recording | SSD Health Monitoring | PLP | Read-Only Mode | 100W PD | 15W Auxiliary Power Supply | 2TB,822,5000.0,80373.0,80373.0,8/27/2024 11:30,10/9/2024 21:00,11/8/2024 22:00,1731074403,Hardware,Duluth,True,False,successful,f6616b151a,2/27/2025,,Description could not be generated
Xebec Snap: Monitors That Instantly Snap Onto Your Laptop,"13.3"" Full-HD Screens | Portrait and Landscape Mode | Integrated Cables | Aluminum and TPE Materials | Mac, PC, Chromebook Compatible",1058,25000.0,692303.0,692303.0,7/1/2023 4:55,8/1/2023 21:57,9/1/2023 14:59,1693551541,Hardware,Austin,True,False,successful,f62ab3c42a,2/27/2025,,Description could not be generated
Wiggle Kit - A New Instrument For Singers,The first truly wireless instrument which enables singers to control effects on their voice through expressive movements.,190,15000.0,18889.75,21926.47981,10/5/2017 20:44,11/8/2017 23:20,12/8/2017 21:00,1512738000,Sound,Eindhoven,True,,successful,f5cf462d7b,2/27/2025,,Description could not be generated
"PRO30: Wireless, Compact, High Fidelity, On-Ear Headphones","On-ear headphones built for mobile lifestyles with durable construction, efficient engineering and wireless connectivity.",1817,125000.0,402413.0,402413.0,9/11/2014 1:47,2/24/2015 9:50,3/29/2015 14:59,1427612342,Gadgets,San Diego,True,,successful,f53eb5eada,2/27/2025,,Description could not be generated
2-in-1 Compact Hybrid Power Screwdriver: H500+,Compact yet Powerful | Adjustable Multi Torque Power| Switchable Auto&Manual | Maximized Efficiency in Various Environments,2748,5000.0,161315.0,161315.0,11/22/2023 17:45,6/10/2024 22:03,7/25/2024 22:03,1721916207,Gadgets,Wilmington,True,False,successful,f53a2c5e66,2/27/2025,,Description could not be generated
"Taco: Basecamp to Zendesk, all your tasks in one place","See all your tasks in one place, from the services you already use (like Google Tasks, GitHub, Zendesk, and RSS). Work on what matters.",194,3500.0,7339.0,7339.0,3/20/2013 23:07,6/14/2013 0:06,7/14/2013 0:06,1373731594,Technology,Seattle,True,,successful,f5342c3a8d,2/27/2025,,Description could not be generated
Joué Play - Everyone can play music,"make a beat, play a melody and build chords naturally on a digital yet expressive music instrument.",613,70000.0,188399.0,204092.7083,2/10/2020 17:41,4/29/2020 0:02,6/10/2020 0:02,1591718544,Hardware,Bordeaux,True,,successful,f510b27683,2/27/2025,,Description could not be generated
HiDock H1: ChatGPT-Powered Audio Dock with AI Summary,Transcription & AI Summary | Noise-free Con-call | Phone-call Recording | 11-in-1 Docking Station,2431,78190.0,4330375.0,553092.8165,9/4/2023 18:33,10/10/2023 21:46,12/9/2023 22:46,1702133191,Gadgets,Hong Kong,True,False,successful,f4fbe94f74,2/27/2025,,Description could not be generated
Ai.Frame: Age of Humanoid Robot,"Ai.Frame is an open-source,miniature humanoid robot. Versatile, abundant upgrades,customizable commands,pre-assembled or self-assembly.",79,5000.0,22560.0,22560.0,5/29/2014 12:56,6/28/2014 22:00,7/28/2014 22:00,1406556017,Robots,Shenzhen,True,,successful,f4c2c4e2f8,2/27/2025,,Description could not be generated
Bitponics - Your Personal Gardening Assistant,"Ever have trouble growing plants? We can help. Bitponics is your automated gardening assistant, guiding you every step of the way.",261,20000.0,23662.04,23662.04,3/7/2012 11:35,5/12/2012 22:20,6/11/2012 22:20,1339424457,Hardware,Brooklyn,True,,successful,f49b9d18a7,2/27/2025,,Description could not be generated
Toymail.  Send Mail To Toys.,"Send mail to kids' toys from your phone. Our toys will speak them back in their funny voice, or yours.  Kids can reply too!",1119,60000.0,83341.0,83341.0,10/23/2013 21:43,11/14/2013 19:57,12/2/2013 19:55,1385985301,Hardware,Brooklyn,True,,successful,f4804e21fa,2/27/2025,,Description could not be generated
Offline Wikipedia iPhone app,This is a project to create a free iPhone app for browsing Wikipedia offline. The code will be open source and I'll launch it with...,25,99.0,145.0,145.0,4/25/2009 13:37,4/25/2009 23:36,7/14/2009 14:59,1247554830,Software,,True,,successful,f462dd43be,2/27/2025,,Description could not be generated
Ambi Climate 2: A.I. Enhanced Air Conditioning Comfort,"Unique A.I. technology detects & analyzes multiple factors, learns your comfort and adjusts your air conditioner for peace of mind.",1016,390000.0,1215905.0,156188.0189,4/22/2017 19:06,5/23/2017 12:00,6/22/2017 11:59,1498103941,Gadgets,Hong Kong,True,,successful,f43a5ccd9f,2/27/2025,,Description could not be generated
DWARF II : A Portable and Versatile Smart Telescope,Easily stargazing and birdwatching with your smartphone,2129,120000.0,6813434.0,873588.324,9/28/2021 16:13,12/1/2021 0:00,1/15/2022 0:00,1642176003,Hardware,Wan Chai,True,False,successful,f434527ebc,2/27/2025,,Description could not be generated
Bioremediation Action Match,"Help beat back pollution!  Using low cost bioremediation methods, brownfields all around Detroit will be cleaned up and put back to productive use.",8,165.0,186.0,186.0,8/29/2010 8:41,8/29/2010 9:03,9/5/2010 11:00,1283655608,Technology,Detroit,True,,successful,f42e31b4a1,2/27/2025,,Description could not be generated
RGB-123 Led Matrices,RGB-123 Making RGB Led Matrices Easy!,564,3000.0,52118.0,52118.0,7/18/2013 2:26,8/14/2013 4:41,9/13/2013 4:41,1379018480,Hardware,Hampton,True,,successful,f400e6f800,2/27/2025,,Description could not be generated
revolights. join the revolution.,"Revolights bike lighting system.
A Bay Area design project.
Our light's different.  We get that.  We embrace it.
Join the revolution.",1442,43500.0,215621.4,215621.4,7/22/2011 1:24,8/10/2011 0:52,9/28/2011 0:52,1317142380,Technology,Palo Alto,True,,successful,f3d9c652a9,2/27/2025,,Description could not be generated
T1M Utility | Construction Digital Tape Measure,"Upgrade Your Tape Measure - Reduce Errors and Speed Up Projects. Seamlessly Display, Store, and Share Accurate Measurements.",3332,5000.0,392550.0,392550.0,6/19/2024 21:55,10/8/2024 20:41,12/7/2024 21:41,1733578865,Hardware,Boston,True,True,successful,f3d3e966e5,2/27/2025,,Description could not be generated
Turing Pi 2 Cluster Computer,"Run up to 4 Raspberry Pi, Nvidia Jetson and Turing RK1 compute modules together.  Build a homelab, learn Kubernetes, self-host apps.",7083,64000.0,2174571.03,2174571.03,9/17/2020 22:41,5/17/2022 0:00,6/16/2022 0:00,1655308800,Hardware,Wilmington,True,,successful,f381d27568,2/27/2025,,Description could not be generated
LazerBlade: The affordable laser cutter / engraver,"The affordable entry-level laser cutter / engraver for the maker, artist and hobbyist.",885,45000.0,569397.01,527414.7934,4/12/2014 14:47,5/24/2014 9:56,6/28/2014 9:56,1403920606,Hardware,Melbourne,True,,successful,f35776c94e,2/27/2025,,Description could not be generated
MeArm - Pocket Sized Industrial Robotics for Everybody,"Low cost, easy to build and simple to control, MeArm is designed to make learning with robotics accessible for everyone.",429,5000.0,24855.0,39064.71013,10/5/2014 4:45,12/16/2014 2:33,1/6/2015 6:00,1420495213,Robots,Nottingham,True,,successful,f33cd87140,2/27/2025,,Description could not be generated
NINJA SPHERE: Next Generation Control of Your Environment,Next generation control of your environment with accurate in-home location data and a gesture control interface.,1772,115000.0,702937.5,659563.2969,11/5/2013 15:35,11/13/2013 10:33,1/12/2014 10:33,1389494013,Hardware,Sydney,True,,successful,f3237b43fa,2/27/2025,,Description could not be generated
Kniterate: The Digital Knitting Machine,Create a design and press knit. A compact digital knitting machine to bring fashion fabrication back to your neighborhood.,488,100000.0,636130.65,636130.65,3/20/2016 19:01,3/29/2017 22:11,5/8/2017 22:11,1494252682,Fabrication Tools,London,True,,successful,f26ce74e58,2/27/2025,,Description could not be generated
Jog It! Open source controller pendant for EMC2 and Mach3!,Jog It! Is an open source hand held controller designed to make running a program in Linux CNC (EMC2) and MACH3 a breeze.,238,2500.0,16862.0,16862.0,10/18/2012 22:04,10/19/2012 8:17,11/18/2012 9:17,1353201444,Hardware,Payson,True,,successful,f21f3cd069,2/27/2025,,Description could not be generated
Lumos Ultra - The New Standard In Bike Helmets,"Integrated LED lighting, turn signals, and smart features to keep you safe in one sleek package.",24943,60000.0,2966439.2,2966439.2,5/12/2020 16:14,5/25/2020 22:57,7/20/2020 11:30,1595215800,Hardware,Boston,True,False,successful,f1e2a06088,2/27/2025,,Description could not be generated
Glyph: A Mobile Personal Theater With Built In Premium Audio,"Experience stark, vivid images like nothing you've ever seen combined with premium audio in a unique flip down form factor.",3331,250000.0,1509506.28,1509506.28,12/6/2013 22:49,1/22/2014 22:22,2/21/2014 22:22,1392992540,Hardware,Ann Arbor,True,,successful,f1e25c0785,2/27/2025,,Description could not be generated
Slidenjoy - Double or triple your screens,"Ultra-thin, light, portable and free-standing. Users can easily unfold it, adding one to two extra screens to their computer.",1626,300000.0,600514.0,663176.9273,7/6/2015 3:48,7/8/2015 3:04,8/10/2015 3:04,1439147079,Technology,Charleroi,True,,successful,f1d7fe8e42,2/27/2025,,Description could not be generated
Rhino Dolly - Big Moves for Small Teams,Capture mind blowing motorized dolly shots with a system that sets up in minutes and packs away in a single case.,70,10000.0,155846.0,155846.0,5/5/2022 3:52,5/18/2022 12:39,6/17/2022 12:39,1655440799,Camera Equipment,Puyallup,True,False,successful,f197a0045a,2/27/2025,,Description could not be generated
The Electron: Cellular dev kit with a global data plan,The Electron is an Arduino-like cellular development kit with a SIM card and affordable data plan from the creators of the Spark Core.,5564,30000.0,578478.33,578478.33,1/6/2015 1:53,2/26/2015 3:15,4/2/2015 6:00,1427925617,DIY Electronics,San Francisco,True,False,successful,f117f04aa5,2/27/2025,,Description could not be generated
Hendo Hoverboards - World's first REAL hoverboard,Hendo is introducing the world's first REAL hoverboard and hover developer kit. We are putting hover technology in YOUR hands.,3169,250000.0,510590.53,510590.53,10/18/2014 0:45,10/21/2014 12:49,12/15/2014 15:59,1418630340,Technology,Los Gatos,True,,successful,f0f2913ce0,2/27/2025,,Description could not be generated
Nix Color Sensor,"Nix is a breakthrough smartphone accessory. Just scan an object and instantly view the color on your iPhone, Android, PC, or Mac.",682,35000.0,69465.33,66737.30909,8/13/2013 23:47,9/9/2013 22:33,10/16/2013 22:33,1381934018,Hardware,Toronto,True,,successful,f0e660b5e3,2/27/2025,,Description could not be generated
MetaWear: Production Ready Wearables in 30 Minutes or Less!,A tiny ARM+Bluetooth LE Platform for developing Wearable products (and more) that are certified and ready to ship to customers.,1887,8000.0,115067.72,115067.72,2/1/2014 7:10,4/1/2014 23:27,5/3/2014 9:00,1399078810,Wearables,San Francisco,True,,successful,f0a9e00118,2/27/2025,,Description could not be generated
hopshack,A mobile encyclopedia for discovering and learning about craft beer and breweries.,109,6000.0,6981.0,6981.0,7/10/2014 4:19,8/13/2014 0:41,9/12/2014 0:41,1410453710,Apps,New Orleans,True,,successful,f0616073c5,2/27/2025,,Description could not be generated
Flic 2: The Perfect Button - Control anything with a push,"You don’t talk to it, you don’t swipe it, you don’t unlock it… just push a button! The Swedish Smart Button is back, perfected.",5046,50000.0,636556.5,636556.5,5/17/2019 22:09,5/21/2019 21:41,6/20/2019 23:00,1561042800,Hardware,Stockholm,True,False,successful,ef7f49254e,2/27/2025,,Description could not be generated
The Keyboardio Preonic,"A wireless ortholinear keyboard that's efficient, compact, comfortable, and incredibly customizable.",1172,30000.0,233570.0,233570.0,3/30/2024 3:23,7/30/2024 21:59,8/31/2024 12:00,1725076801,Hardware,Berkeley,True,True,successful,ef4caa3502,2/27/2025,,Description could not be generated
Excope DT1|The World's Lightest Super Telephoto Camera,200x Magnification|400mm Focal Length|Moon Shot|48 Megapixel|Cost Effective|Easy Handling|Super Computing Power|Free App|Wifi Control,4891,20000.0,1259347.0,1259347.0,12/22/2023 18:07,4/16/2024 22:00,6/15/2024 22:00,1718460011,Camera Equipment,Boulder,True,False,successful,ef0f69cad4,2/27/2025,,Description could not be generated
Virtuali-Tee: The Ultimate Way to Learn About the Body!,"Kids switch on when you bring a subject to life. For just the price of a t-shirt, teach your kids about the anatomy.",1581,70000.0,74571.0,103287.7962,2/23/2016 17:57,3/1/2016 23:03,4/1/2016 6:30,1459463402,Wearables,London,True,,successful,eeab917703,2/27/2025,,Description could not be generated
E1 Camera. 4K UHD interchangeable lens camera,4K UHD. Smallest form factor camera. Supports all Panasonic/Olympus MFT lenses and incredible low light performance. $699.00 MSRP.,564,42000.0,306973.55,306973.55,5/1/2015 21:03,7/17/2015 3:46,8/16/2015 3:46,1439668002,Camera Equipment,Las Vegas,True,,successful,ee3b06739a,2/27/2025,,Description could not be generated
Help us build a satellite,We are a multi-disciplinary engineering student team that is building a small satellite to test the self-healing material in space.,218,15000.0,15426.3,14912.0865,9/14/2013 0:36,10/17/2013 2:34,12/1/2013 12:59,1385873940,Technology,Montreal,True,,successful,ee0794f51a,2/27/2025,,Description could not be generated
SAM: The Ultimate Internet Connected Electronics Kit,"Start making without coding. Beginner or Expert, SAM is the ultimate electronics kit for inventors, artists, and students.",817,50000.0,125546.01,203970.7068,11/4/2013 23:47,9/29/2014 17:51,10/29/2014 17:51,1414576266,DIY Electronics,London,True,,successful,ede4f5f255,2/27/2025,,Description could not be generated
"Phrozen Arco 3D Printer - Larger, Faster, More Colors",300*300*300 mm³ Print Volume | 600 mm/s Print Speed | Multi-Color Printing | Auto-Leveling | Powered by Klipper | Core-XY Design,1413,10000.0,1408493.0,1408493.0,1/4/2024 10:52,2/22/2024 23:43,4/7/2024 22:43,1712501028,3D Printing,Taipei City,True,False,successful,eda9d0b7b9,2/27/2025,,Description could not be generated
Sesame Ring - Where will it take you?,"Wearable Charlie Cards, so you can pay public transport fares with a dash of style.",798,5000.0,19120.77,19120.77,8/2/2013 14:41,8/22/2013 21:57,9/14/2013 23:59,1379174340,Technology,Cambridge,True,,successful,ed6a2182d1,2/27/2025,,Description could not be generated
modue: Next-Gen Modular Control Station,"Customizable modular hardware for easy navigation through Your Digital World - system, games, apps and more...",910,40000.0,356640.0,388847.4558,5/11/2023 2:44,1/24/2024 0:50,2/27/2024 0:50,1708966257,Hardware,Krasnik,True,False,successful,ed53111158,2/27/2025,,Description could not be generated
EM3 Ether: 9mm Super-Thin VR Glasses for Gaming and Movies,3DOF Supported | 5K Resolution Combined | 65g Ultralight | 9mm Super-Thin Lenses | 2D/3D/VR Immersive Viewing,960,10000.0,308084.0,308084.0,3/14/2023 11:53,4/12/2023 21:00,5/15/2023 21:00,1684155652,Gadgets,Washington,True,False,successful,ed2b6edc97,2/27/2025,,Description could not be generated
Prototypo | Streamlining font creation,"Prototypo is an open-source online typeface editor: start shaping a complete typeface using sliders, then refine spacing and outlines.",1670,12000.0,34133.37,56570.17721,3/6/2014 21:28,4/8/2014 22:32,5/10/2014 0:00,1399651211,Web,London,True,,successful,ed2168b741,2/27/2025,,Description could not be generated
EcoFlow R600 - World's Fastest Charging Power Station,"Modular Design for Increased Capacity; 
600W Smart Inverter; 
Chainable AC Power; 
From 0 to 80% in 1 hour; 
EcoFlow Mobile App",3019,100000.0,2035294.1,2035294.1,4/28/2020 20:23,5/12/2020 21:45,6/26/2020 21:45,1593179104,Hardware,San Francisco,True,False,successful,ecc873f86b,2/27/2025,,Description could not be generated
The Othermill: Custom Circuits at Your Fingertips,"An easy to use, affordable, computer controlled mill. Take all your DIY projects further with custom circuits and precision machining.",652,50000.0,311657.1,311657.1,4/12/2013 3:26,5/6/2013 3:45,6/5/2013 3:45,1370375133,Hardware,San Francisco,True,,successful,ec9252ba77,2/27/2025,,Description could not be generated
