name,subtitle,backers,goal,pledged,usd_pledged,created_at,launched_at,deadline,state_changed_at,category,location,staff_pick,is_in_post_campaign_pledging_phase,state,campaign_id,scrape_date,days_left,description
Maslow CNC - a $500 open source 4 by 8 foot CNC Machine,"An open source 4 by 8 foot CNC cutting machine for under $500. A router designed to let you cut big, useful things out of wood and more",1279,50000.0,314547.5,314547.5,9/22/2016 3:18,10/25/2016 23:50,11/23/2016 13:00,1479877200,Fabrication Tools,Port Townsend,True,,successful,8e1d10f53f,2/27/2025,,Description could not be generated
"Lab-On-The-Go, learn electronics with confidence",A comprehensive and portable package to learn the fundamentals of electronics through building and experimenting,210,3500.0,65270.29,48866.38253,8/16/2022 12:22,11/19/2022 5:30,12/29/2022 5:30,1672263011,DIY Electronics,Vancouver,True,False,successful,8d34018223,2/27/2025,,Description could not be generated
POND - Wireless Charging - Refined and Redefined,Wireless charging for Android and Windows phones with Qi capablity (see FAQ) + now for iPhone 5/5s with the fastest Qi enabling case!,204,30000.0,31744.0,31744.0,3/26/2014 2:07,7/1/2014 2:00,7/31/2014 2:00,1406743212,Gadgets,San Diego,True,,successful,8ca8297941,2/27/2025,,Description could not be generated
Power Laces,"Power Laces- a cool piece of ""Future Tech"" that every kid of the 80s wanted, and can also improve the life of those with with motor disabilities.",278,25000.0,25024.5,25024.5,7/17/2010 6:44,8/29/2010 21:06,10/11/2010 14:59,1286780410,Technology,San Francisco,True,,successful,8c8f59380b,2/27/2025,,Description could not be generated
"Viewbox, a VR headset","A foldable ""Virtual Reality"" headset for smartphones up to 90x170mm (3.5x6.7 inches) made out of neoprene.",710,80000.0,279110.0,37018.66911,11/26/2014 1:24,12/10/2014 1:31,1/9/2015 1:31,1420738318,Hardware,Kalmar,True,,successful,8c1a29a57d,2/27/2025,,Description could not be generated
"Fixer3D: professional tool for 3D print finish, repair, glue","Handy pen to apply solder paste, bond, and fix anything for DIY board! 3D Printer tool: Digital liquid dispensing syringe + UV LED",212,5000.0,24915.37,24915.37,2/26/2016 2:57,3/2/2016 3:30,4/16/2016 2:30,1460745058,3D Printing,Willow Grove,True,,successful,8bf02a97f1,2/27/2025,,Description could not be generated
Digitize the Afro American Newspaper Using Open Source Robot,"Project Gado is using an autonomous, open source archival scanning robot to digitize 20,000 photos from the Afro American Newspaper",69,1000.0,3007.11,3007.11,3/9/2012 2:09,3/10/2012 22:40,4/9/2012 21:40,1333978849,Hardware,Baltimore,True,,successful,8bab65bb1f,2/27/2025,,Description could not be generated
"Whoa Board: Dream With Touch Sensing EL Wire, Panels, Paint",The Whoa Board makes things glow.  It also makes glow-y things sense touch. It's an open prototyping platform for wearable electronics!,307,25000.0,26857.0,26857.0,7/1/2016 2:55,8/3/2016 12:27,9/6/2016 12:27,1473136067,Hardware,Somerville,True,,successful,8b0faf93b2,2/27/2025,,Description could not be generated
"BeeLine - smart navigation for bicycles, made simple","BeeLine is a stripped back, intuitive, navigation device designed to put the cycling masses back in control of their journey",3038,60000.0,150185.54,230578.6205,9/2/2015 18:03,10/28/2015 21:56,11/27/2015 22:56,1448636171,Hardware,London,True,False,successful,8a853ced7f,2/27/2025,,Description could not be generated
A wireless wind meter containing no electronics,"Measure the wind with your iPhone, iPad or Android phone and share it online. Check conditions at your favorite spots on a live map.",915,20000.0,27598.0,41714.0897,2/13/2013 14:55,3/19/2013 6:40,4/23/2013 6:40,1366670451,Hardware,Copenhagen,True,,successful,89566063ec,2/27/2025,,Description could not be generated
LoCoMoGo Train | Learn Coding Through Play,The toy train teaching children aged 4-12 coding through play. Educational journey from screen-less play to full on programming.,621,10000.0,116218.42,125765.805,8/28/2019 22:21,2/25/2020 21:00,3/26/2020 20:00,1585224005,Robots,Amsterdam,True,False,successful,8937d904ff,2/27/2025,,Description could not be generated
SuperBase V: First Plug-and-Play Home Energy Storage System,Up to 64kWh | 3800-7600W AC Output | 120/240V Dual Voltage | Max 6.6kWh Recharge in 1 Hour | Semi-Solid State & LFP Batteries | 0ms UPS,1183,10000.0,5394102.0,5394102.0,6/28/2022 14:56,9/29/2022 23:45,11/20/2022 0:45,1668876312,Hardware,Palo Alto,True,False,successful,88f72f9572,2/27/2025,,Description could not be generated
3D Printer Monsters Are Headed This Way!,"Designate your 3D Printer as ground zero for monster-fighting special ops, and help secure Earth!",56,4000.0,4508.0,4508.0,8/6/2015 2:31,9/25/2015 22:23,11/1/2015 11:59,1446350340,3D Printing,West Palm Beach,True,,successful,88f2ef9ce9,2/27/2025,,Description could not be generated
AirBeam: Share & Improve Your Air,"AirBeam is a wearable air monitor that maps, graphs & crowdsources your pollution exposures in real-time.",333,50000.0,55833.0,55833.0,8/19/2014 22:27,10/20/2014 23:25,11/20/2014 0:25,1416414347,Gadgets,Brooklyn,True,,successful,87cceb68c8,2/27/2025,,Description could not be generated
"WoFi, A Cloud Connected Sampler Synthesizer",We modernized the classic 80s keyboard samplers.,193,100000.0,104690.0,110171.5872,6/1/2023 14:50,10/18/2023 0:59,11/17/2023 1:59,1700157551,Hardware,Avignon,True,,successful,877d62d25f,2/27/2025,,Description could not be generated
Picade: The arcade cabinet kit for your mini computer,"A stylish, retro, and fun arcade cabinet for your Raspberry Pi, Mini-ITX, Pandaboard, or other mini PC from the makers of Pibow",625,32768.0,74134.0,118735.9857,10/21/2012 19:08,10/31/2012 7:54,11/30/2012 7:54,1354233296,Hardware,Sheffield,True,,successful,8740c2e23a,2/27/2025,,Description could not be generated
LUMIONIX KOMET: Take Your Photography Above and Beyond,"A Camera Trigger packed with: High-Speed, Wireless Flash Control, Timelapse, HDR, AI Suggestion, Geo-Tag, File Manager and more",1108,15000.0,276937.0,276937.0,7/20/2022 7:42,10/17/2023 22:01,12/16/2023 23:01,1702738892,Camera Equipment,Middletown,True,False,successful,871788e63b,2/27/2025,,Description could not be generated
ALOH : The World’s First Floating Plasma Toroid Lamp,Discover a groundbreaking blend of art and tech—experience the unique glow of our xenon-powered plasma toroid that transforms any space,252,3000.0,115637.0,115637.0,2/19/2024 13:36,10/2/2024 16:00,11/22/2024 12:00,1732248001,Technology,New York,True,False,successful,8715e455b6,2/27/2025,,Description could not be generated
The Effect of Lunar Gravity on Grapevine Berry Quality,We seek funding for experimental research exploring the effect of moon gravity on the quality of grapevine berries.,53,2500.0,2536.0,4269.985663,5/10/2014 6:26,5/15/2014 19:48,6/12/2014 1:15,1402506911,Technology,Lisbon,True,,successful,865361c75c,2/27/2025,,Description could not be generated
Altergaze: 3D printed VR Goggles for Smartphones,"Customisable, 3D printed, smartphone based Virtual Reality Goggles distributed through crowd manufacturing.",456,25000.0,31988.55,53561.43587,12/21/2013 7:46,3/3/2014 17:22,5/2/2014 5:30,1398979811,3D Printing,London,True,,successful,8626bc10be,2/27/2025,,Description could not be generated
Apollo 2.0: The Future of Personalized Well-Being,Changing lives with next-generation wearable technology—one vibe at a time.,2804,100000.0,1179308.0,1179308.0,11/22/2024 4:28,12/10/2024 23:01,1/19/2025 23:01,1737298895,Wearables,Pittsburgh,True,False,successful,8619b40b9c,2/27/2025,,Description could not be generated
Support Team USA in the Giant Robot Duel!,"We need your help to create the giant combat robot America deserves. With you and our amazing partners, together we can defeat Japan!",7857,500000.0,554592.4,554592.4,7/11/2015 4:01,8/18/2015 20:01,9/18/2015 20:01,1442577691,Robots,Oakland,True,,successful,85c5af58ed,2/27/2025,,Description could not be generated
Wonderblend - A Combat Robot made by Highschoolers,"Wonderblend is a giant, 120 pound killing machine made by teenagers.  Try to imagine what would happen if lawnmower and a Harley had a baby. ",47,1000.0,1210.01,1210.01,4/24/2010 12:48,5/2/2010 2:40,6/1/2010 18:00,1275386410,Technology,Portland,True,,successful,8575deff40,2/27/2025,,Description could not be generated
Global Village Construction Set,"Sharing the world's first low-cost, DIY, open-source Tractor, Compressed Earth Brick Press, Power Cube, and Soil Pulverizer.",1384,40000.0,63573.7,63573.7,9/29/2011 14:30,10/11/2011 0:18,11/20/2011 1:18,1321723103,Hardware,Maysville,True,,successful,856c5130f7,2/27/2025,,Description could not be generated
TIMEMORE Electric Coffee Grinder,Enjoy a freshly ground barista quality coffee at home with one touch,10836,20000.0,6701074.2,4988850.767,2/7/2023 13:28,3/14/2023 22:45,5/13/2023 22:45,1683989141,Hardware,Singapore,True,False,successful,85599d3be0,2/27/2025,,Description could not be generated
Tachyon: Powerful 5G single-board computer w/ AI accelerator,"Embed intelligence into anything, anywhere with this Snapdragon-powered credit card-sized computer from Particle.",2267,10000.0,523100.0,523100.0,4/18/2024 22:07,7/31/2024 0:56,8/30/2024 11:56,1724990203,Hardware,San Francisco,True,False,successful,853c8911ca,2/27/2025,,Description could not be generated
Digitsole: The first interactive insole to heat your feet,"Digitsole is the first connected insole on the market controlled via your smartphone - warm your feet, track your distance and calories",606,40000.0,90074.0,90074.0,7/24/2014 20:58,9/3/2014 0:05,11/2/2014 0:05,1414857923,Technology,Nancy,True,,successful,8532abccb4,2/27/2025,,Description could not be generated
TerraMaster D8 Hybrid+NAS Bundle: Storage Upgrade Made Easy,Expand NAS Space | Up to 128TB | Hot & Cold Data Segregation | 2+6 RAID Modes | Up to 10Gbps | 4 Hardware Adjustment Modes,1129,78363.0,2523376.0,322886.1714,3/21/2024 16:12,5/7/2024 21:44,6/6/2024 21:44,1717681468,Hardware,Wan Chai,True,False,successful,850677a466,2/27/2025,,Description could not be generated
"Ares - Finally, a drone everyone can fly",Capturing amazing aerial shots has never been easier. Just draw where you want to fly on your iPhone or iPad. Our drone does the rest.,105,50000.0,62387.0,62387.0,3/17/2015 6:20,3/25/2015 12:02,4/24/2015 12:02,1429848155,Flight,State College,True,,successful,84e60636b5,2/27/2025,,Description could not be generated
Hooke Lav: A Sleek Wireless Mic With Pro-Grade Sound,A wearable microphone with studio-quality sound that captures dropout-free audio with one click,3461,10000.0,580753.0,580753.0,4/23/2020 22:15,9/22/2020 21:06,10/22/2020 21:06,1603372006,Sound,Chicago,True,False,successful,84c65b7abc,2/27/2025,,Description could not be generated
Launch a TARDIS into SPACE!,I'll be launching a small model TARDIS into (near) SPACE and filming the ascension and descension as a mini-documentary for YouTube.,151,500.0,3307.0,3307.0,8/28/2012 6:42,8/30/2012 5:39,9/13/2012 11:59,1347508740,Space Exploration,Sandusky,True,,successful,84aacb11bd,2/27/2025,,Description could not be generated
"Vitaloop: Get pure water from any lake, river, pond or sink",Automatic | One-touch | 5 stage filtration | Versatile | Durable | 13 Gallons (50 L) of water per charge | Great Taste,1066,5000.0,158580.0,158580.0,10/10/2023 15:21,10/17/2023 23:24,12/6/2023 15:58,1701849480,Gadgets,Oslo,True,False,successful,849ebea7dc,2/27/2025,,Description could not be generated
AstroBrew: The Ultimate Cold Brew Coffee Maker,In five minutes brew and chill cold brew to 32ºF. Authentic and smooth. No pods. Any blend.,614,10000.0,145482.0,145482.0,10/18/2023 22:52,7/23/2024 19:44,8/23/2024 11:59,1724385541,Hardware,Boston,True,False,successful,8467576926,2/27/2025,,Description could not be generated
MAONOCASTER: A Portable All-In-One Podcast Production Studio,Multichannel mixer | Built-in battery | High quality preamp | Voice FX | Record & stream live | No post-editing | Programmable jingles,3384,5000.0,716088.0,716088.0,4/21/2020 15:32,5/11/2020 21:59,6/25/2020 21:59,1593093568,Hardware,Katy,True,False,successful,84574372dc,2/27/2025,,Description could not be generated
FishBit: Your Aquarium Made Simple (Beta Release),FishBit is an app and connected device to monitor and control your aquarium’s water composition to help your tank thrive.,183,5000.0,11745.0,11745.0,11/6/2014 4:55,1/7/2015 3:44,2/6/2015 3:44,1423165441,Hardware,San Francisco,True,,successful,8357380838,2/27/2025,,Description could not be generated
MagCool OmniGrip: Magnetic Multi-functional Shooting Handle,"ProRes Recording (M.2 Slot) | Semiconductor Cooling | Magnetic Design, MagSafe™️ Compatible | Ring Light | Expandable Accessories",368,10000.0,254925.0,32763.47085,10/22/2024 17:42,12/10/2024 21:58,1/19/2025 21:58,1737295090,Camera Equipment,Hong Kong,True,False,successful,8346129cd9,2/27/2025,,Description could not be generated
Cubetto - Hands on coding for ages 3 and up,"A playful programming language you can touch. Montessori approved, and LOGO Turtle inspired. Learn programming away from the screen.",6553,100000.0,1596457.66,1596457.66,9/8/2014 23:56,3/8/2016 18:51,4/7/2016 17:51,1460022674,Hardware,San Francisco,True,,successful,8302fb834d,2/27/2025,,Description could not be generated
Iris smart ring | Elevate style. Embrace self-awareness.,Join the Movement for Universal Access to Cutting-Edge Healthcare.,3465,100000.0,622672.0,678277.1638,11/1/2022 18:48,2/15/2023 21:09,3/17/2023 20:09,1679054967,Wearables,Neuchatel,True,False,successful,82e8af023f,2/27/2025,,Description could not be generated
"Tarion Zone: Modular, Customizable Organizer & Backpack",Build Your Own Bag | LEGO-like system | Fully Customizable | Expandable | Light-weight | For long & short trips | City & Outdoors,407,100000.0,373401.0,48029.37201,7/5/2021 14:56,8/3/2021 23:00,9/3/2021 23:00,1630681255,Camera Equipment,Suzhou,True,False,successful,826e71d73e,2/27/2025,,Description could not be generated
Porcelite Ceramic Resin for SLA/DLP 3D Printing,"Ceramic porcelain resin is now available for SLA, DLP or other UV printer technology.",140,5000.0,20597.0,20597.0,11/24/2015 0:49,2/2/2016 4:52,3/3/2016 4:52,1456951957,3D Printing,Omaha,True,,successful,8244f5dee4,2/27/2025,,Description could not be generated
iMicro Q2: An 800x Fingertip Microscope for Any Smartphone,"Tiny, light, easy to use, compatible with any smartphone, affordable while optical performance comparable to a pro desktop microscope",8924,13200.0,535909.79,406223.0721,7/17/2020 13:02,10/19/2020 22:05,12/18/2020 23:05,1608303938,Gadgets,Shanghai,True,False,successful,815965347c,2/27/2025,,Description could not be generated
VERVE: Plug the world into your computer,"Interact with your computer in a whole new way. Play a favorite game or app using light, motion, magnets and more. No coding required!",409,20000.0,38617.0,38617.0,9/18/2013 16:29,10/24/2013 1:46,11/26/2013 2:46,1385405172,Technology,Irvine,True,,successful,811387140a,2/27/2025,,Description could not be generated
"PiScreen: A 3.5""  TFT with touchscreen for the Raspberry Pi","All the hardware needed to add a 3.5"" TFT (480x320) with touchscreen control to your Raspberry Pi, never need a monitor again!",1000,4400.0,82664.0,74117.57653,12/8/2013 10:26,3/14/2014 4:26,4/13/2014 4:26,1397334373,Hardware,Sydney,True,,successful,80e584195f,2/27/2025,,Description could not be generated
Vidcode: A Coding App Created with Girls in Mind,Vidcode teaches girls computer programming by enabling them to create video effects with code.,526,25000.0,31803.0,31803.0,8/8/2014 2:50,9/22/2014 12:51,10/22/2014 12:51,1413953473,Technology,New York,True,,successful,80bcd57bdc,2/27/2025,,Description could not be generated
"Lil’Bot, the little robot that could","A low-cost, open-source, Arduino-compatible balancing robot for learning, hacking and delight",138,15000.0,18174.55,18174.55,3/8/2014 1:52,5/17/2014 17:34,6/19/2014 11:30,1403148611,Robots,Mountain View,True,,successful,806b6ec830,2/27/2025,,Description could not be generated
MAKERbuino - a DIY game console,"MAKERbuino is a handheld retro gaming device that you can build yourself. It's 8-bit, fun, educational and hackable.",1574,10000.0,100745.0,100745.0,3/9/2017 23:42,3/25/2017 2:02,4/19/2017 2:02,1492538543,DIY Electronics,Zagreb,True,False,successful,8047b10efa,2/27/2025,,Description could not be generated
Meet Loona - The most Intelligent Petbot,She's so playful and affectionate you'll forget she's a robot.,7811,20000.0,3004517.67,3004517.67,8/22/2022 18:40,9/15/2022 23:01,11/1/2022 19:55,1667303715,Robots,Los Angeles,True,False,successful,80394fe1af,2/27/2025,,Description could not be generated
ChompSaw: A kid-safe power tool for cutting cardboard,Unleash your creative potential - for inventors of all ages!,5049,50000.0,1175102.0,1175102.0,6/1/2023 11:50,9/28/2023 22:43,10/28/2023 22:43,1698504203,Fabrication Tools,Philadelphia,True,False,successful,7f8a8bef77,2/27/2025,,Description could not be generated
EcoFlow DELTA Pro: The Portable Home Battery,Expandable capacity (3.6-25kWh) | Power almost anything (3.6-7.2kW) | Home battery ecosystem,3199,100000.0,12179651.05,12179651.05,6/30/2021 19:52,7/15/2021 21:39,9/13/2021 21:39,1631540391,Hardware,Los Angeles,True,False,successful,7f48879257,2/27/2025,,Description could not be generated
GLANCE SCROLL: The All In One Scrolling LED Ticker,"Glance Scroll is a Vegas Style Subscription Free Sport, Stock, and Life Style Scrolling LED Ticker designed to spruce your space!",1024,20000.0,550319.0,550319.0,7/27/2024 4:15,9/10/2024 21:56,10/11/2024 11:59,1728619140,Hardware,Miami,True,False,successful,7ec8a9116c,2/27/2025,,Description could not be generated
Nebo Motion Controlled Slider: The World's Lightest Slider,The world's most lightweight and portable motion controlled slider for video and timelapse photography.,119,50000.0,50254.11,50254.11,7/15/2014 22:36,8/12/2014 22:41,9/13/2014 9:00,1410570012,Camera Equipment,Provo,True,,successful,7e4504dacc,2/27/2025,,Description could not be generated
The Hip-Hop Word Count: A Searchable Rap Almanac,"The Hip-Hop Word Count is a searchable ethnographic database built from the lyrics of over 40,000 Hip-Hop songs from 1979 to present day.",349,7500.0,8441.72,8441.72,5/25/2010 7:58,12/15/2010 7:14,2/14/2011 7:14,1297638918,Software,Brooklyn,True,,successful,7e2e99c060,2/27/2025,,Description could not be generated
Project Mushroom,A community platform for justice and action on an overheating planet.,2343,200000.0,201989.3,201989.3,11/10/2022 7:01,11/18/2022 11:34,12/16/2022 13:59,1671170341,Software,Minneapolis,True,,successful,7dd1e630c5,2/27/2025,,Description could not be generated
Hooke: Wireless 3D Audio Headphones,Bluetooth headphones with a twist - listen to your favorite music AND capture 3D Audio. Hear and capture your world in a whole new way.,1385,100000.0,163166.14,163166.14,7/13/2014 8:24,9/30/2014 19:45,10/30/2014 19:45,1414669535,Wearables,Brooklyn,True,,successful,7d8732f3d0,2/27/2025,,Description could not be generated
Simple Bracket,Simple Bracket is an iPhone app for filling in college basketball tournament brackets and competing with friends and family.,1211,10000.0,12443.9,12443.9,1/17/2013 22:27,2/5/2013 23:10,3/6/2013 12:59,1362545940,Apps,New York,True,,successful,7d72534405,2/27/2025,,Description could not be generated
"pi-top [4] the smarter way to design, code & make anything!",Design. Code. Make. Powered by the brand new Raspberry Pi 4,521,100000.0,196453.0,196453.0,6/13/2019 22:40,7/9/2019 22:55,8/8/2019 22:55,1565276115,Hardware,London,True,False,successful,7d6ff0be9a,2/27/2025,,Description could not be generated
LARQ Bottle - Water Purification in a Self-Cleaning Bottle,No more stinky water bottles.  LARQ harness UV-C LED light to eliminate 99.9999% of bio-contaminants from your water and bottle.,12758,30000.0,1374021.0,1374021.0,9/21/2017 2:12,11/7/2017 20:57,12/7/2017 20:57,1512651436,Technology,San Francisco,True,False,successful,7d675db445,2/27/2025,,Description could not be generated
Wear  --  A wearable personal assistive listening device,"Wear is an affordable, attractive, lightweight wearable assistive directional microphone designed to improve quality of hearing.",384,30000.0,40168.0,40168.0,10/17/2013 7:12,12/14/2013 1:15,1/13/2014 1:15,1389546953,Sound,Brooklyn,True,,successful,7d61e0a1b2,2/27/2025,,Description could not be generated
OSSIC X: The first 3D audio headphones calibrated to you,OSSIC X is the world's first headphone that instantly calibrates to your anatomy for the most accurate and immersive 3D audio.,10263,100000.0,2708472.39,2708472.39,2/5/2016 0:59,2/23/2016 16:07,4/21/2016 23:00,1461250801,Sound,San Diego,True,,successful,7d3b68aec3,2/27/2025,,Description could not be generated
MiniToy 3D Printer,MiniToy 3D Printer - The World’s First Kid-friendly and STEAM Ready 3D printer.,263,50000.0,74834.79,74834.79,5/5/2016 9:34,5/11/2016 1:00,6/25/2016 1:00,1466787603,3D Printing,Orlando,True,,successful,7d3905f405,2/27/2025,,Description could not be generated
"Filastruder: A robust, inexpensive filament extruder.","Create your own low-cost, quality filament at home!",875,5000.0,212278.66,212278.66,2/18/2013 1:53,3/26/2013 7:02,4/25/2013 7:02,1366844538,Hardware,Gainesville,True,,successful,7c5c2ce74d,2/27/2025,,Description could not be generated
Super Awesome Sylvia's WaterColorBot,The Friendly and Educational Art Robot that Paints with Watercolors!,445,50000.0,89408.99,89408.99,7/16/2013 3:27,7/16/2013 19:00,8/15/2013 19:00,1376564439,Hardware,Sunnyvale,True,,successful,7c067a1ced,2/27/2025,,Description could not be generated
Striv - Meet Your Personal Running Coach,NextGen Smart Insole : 250+ Advance Sensors | AI-Powered Running Coach | Garmin/Strava | 2-Week Battery Life | Olympian Tested,1209,21790.0,318346.0,318346.0,7/19/2024 12:31,10/22/2024 21:59,12/1/2024 22:59,1733065183,Wearables,Boston,True,True,successful,7bed826ccf,2/27/2025,,Description could not be generated
Pantelligent: Intelligent Pan - Cook Everything Perfectly,The smart frying pan of the future. Now anyone can cook delicious meals perfectly. The secret ingredient is temperature control.,464,30000.0,83206.0,83206.0,9/25/2014 9:16,11/19/2014 3:49,1/6/2015 15:59,1420531142,Gadgets,Mountain View,True,,successful,7bb3022b6b,2/27/2025,,Description could not be generated
Platypod® Handle - Camera Riser and Adapter,"Multifunction compact grip & tripod tool to adapt photography, video, lighting, sound and monitoring gear to your ballhead and camera.",1539,10000.0,127767.0,127767.0,2/10/2023 10:12,4/27/2023 1:29,6/1/2023 15:00,1685602800,Camera Equipment,East Brunswick,True,False,successful,7b76e429ae,2/27/2025,,Description could not be generated
ZEROHOUR RELIC XR: Tactical USB Battery Backup Flashlight,Micro-USB rechargeable tactical flashlight with 3400mAh USB battery backup. Charges Android & iPhone. Bike & weapon mountable.,1435,25000.0,250230.0,250230.0,11/24/2014 4:55,1/6/2015 23:40,2/6/2015 13:00,1423198812,Gadgets,Huntington Beach,True,,successful,7b7348f840,2/27/2025,,Description could not be generated
"Linkbot, Create with Robots","Easy to get started, Arduino-compatible, Raspberry Pi friendly, robot loaded with absolute encoding, accelerometer, Battery and ZigBee.",245,40000.0,45792.0,45792.0,4/24/2013 4:20,5/19/2013 5:01,6/19/2013 3:00,1371582034,Hardware,Davis,True,,successful,7b339a0a16,2/27/2025,,Description could not be generated
The 1947-T Mk1 Revision II,"A boutique, Bakelite & Glass Meter, instrumented 12/24 hour clock (restricted edition)",63,7500.0,16349.0,22490.25711,4/6/2021 15:07,4/9/2021 20:40,4/25/2021 20:40,1619354418,Hardware,West Sussex,True,,successful,7b2fc2be82,2/27/2025,,Description could not be generated
PHENOL Patchable Analog Synthesizer,An affordable patchable analog synthesizer. Create music and sound like never before with this unique instrument.,196,55000.0,142414.0,125092.8887,12/5/2014 7:03,12/6/2014 13:44,1/16/2015 12:59,1421384341,Sound,Toronto,True,,successful,7b293d0dc9,2/27/2025,,Description could not be generated
The Køben - a modern electric bike for the human race.,"The Karmic Koben is a modern ebike that lets you ride faster, go farther, all while having more fun than ever before.",268,195000.0,259385.0,259385.0,2/25/2015 18:47,5/5/2015 22:31,6/6/2015 8:00,1433548812,Hardware,Palo Alto,True,,successful,7aeac5101f,2/27/2025,,Description could not be generated
Pawly Door: The Smart Cat Door With Prey Detection,"The Pawly Door detects when your cat tries to bring home prey, keeps intruders outside, and helps you find your missing cat.",694,15000.0,248565.0,267119.9522,5/12/2023 15:22,9/13/2023 16:00,10/28/2023 16:00,1698480001,Gadgets,Zurich,True,False,successful,7a98101065,2/27/2025,,Description could not be generated
UFACTORY Lite 6 – Most Affordable Collaborative Robot Arm,"The preferred robot arm for small and medium-sized enterprises, robotic researchers, and engineers.",417,50000.0,673893.0,673893.0,10/1/2021 16:27,10/26/2021 20:42,11/20/2021 21:42,1637415770,Robots,New Castle,True,False,successful,7a526c65e1,2/27/2025,,Description could not be generated
APOC: Mini Radiation Detector,The APOC is a gamma particle detector that will help you learn about radiation and find radioactive things!,701,5000.0,56590.0,56590.0,10/27/2012 1:57,2/19/2013 12:38,4/20/2013 11:38,1366429101,Hardware,Seattle,True,,successful,7a48e4d1f3,2/27/2025,,Description could not be generated
PancakeBot - The world's first pancake printer!,Don’t just make pancakes. Create them! Introducing PancakeBot - The coolest addition to your kitchen. *Batter not included,2074,50000.0,460584.0,460584.0,1/25/2015 6:50,3/6/2015 22:41,4/10/2015 21:41,1428673313,Robots,New York,True,,successful,79df33a942,2/27/2025,,Description could not be generated
